exploit/aix/local/ibstat_path,ibstat $PATH Privilege Escalation
exploit/windows/browser/awingsoft_winds3d_sceneurl,AwingSoft Winds3D Player 3.5 SceneURL Download and Execute
exploit/windows/browser/baofeng_storm_onbeforevideodownload,BaoFeng Storm mps.dll ActiveX OnBeforeVideoDownload Buffer Overflow
exploit/windows/browser/barcode_ax49,RKD Software BarCodeAx.dll v4.9 ActiveX Remote Stack Buffer Overflow
exploit/windows/browser/blackice_downloadimagefileurl,Black Ice Cover Page ActiveX Control Arbitrary File Download
exploit/windows/browser/c6_messenger_downloaderactivex,Icona SpA C6 Messenger DownloaderActiveX Control Arbitrary File Download and Execute
exploit/windows/browser/ca_brightstor_addcolumn,CA BrightStor ARCserve Backup AddColumn() ActiveX Buffer Overflow
exploit/windows/browser/chilkat_crypt_writefile,Chilkat Crypt ActiveX WriteFile Unsafe Method
exploit/windows/browser/cisco_anyconnect_exec,Cisco AnyConnect VPN Client ActiveX URL Property Download and Execute
exploit/windows/browser/cisco_playerpt_setsource,Cisco Linksys PlayerPT ActiveX Control Buffer Overflow
exploit/windows/browser/cisco_playerpt_setsource_surl,Cisco Linksys PlayerPT ActiveX Control SetSource sURL Argument Buffer Overflow
exploit/windows/browser/citrix_gateway_actx,Citrix Gateway ActiveX Control Stack Based Buffer Overflow Vulnerability
exploit/windows/browser/clear_quest_cqole,IBM Rational ClearQuest CQOle Remote Code Execution
exploit/windows/browser/communicrypt_mail_activex,CommuniCrypt Mail 1.16 SMTP ActiveX Stack Buffer Overflow
exploit/windows/browser/creative_software_cachefolder,Creative Software AutoUpdate Engine ActiveX Control Buffer Overflow
exploit/windows/browser/crystal_reports_printcontrol,Crystal Reports CrystalPrintControl ActiveX ServerResourceVersion Property Overflow
exploit/windows/browser/dell_webcam_crazytalk,Dell Webcam CrazyTalk ActiveX BackImage Vulnerability
exploit/windows/browser/dxstudio_player_exec,Worldweaver DX Studio Player shell.execute() Command Execution
exploit/windows/browser/ea_checkrequirements,Electronic Arts SnoopyCtrl ActiveX Control Buffer Overflow
exploit/windows/browser/ebook_flipviewer_fviewerloading,FlipViewer FViewerLoading ActiveX Control Buffer Overflow
exploit/windows/browser/enjoysapgui_comp_download,EnjoySAP SAP GUI ActiveX Control Arbitrary File Download
exploit/windows/browser/enjoysapgui_preparetoposthtml,EnjoySAP SAP GUI ActiveX Control Buffer Overflow
exploit/windows/browser/facebook_extractiptc,Facebook Photo Uploader 4 ActiveX Control Buffer Overflow
exploit/windows/browser/foxit_reader_plugin_url_bof,Foxit Reader Plugin URL Processing Buffer Overflow
exploit/windows/browser/getgodm_http_response_bof,GetGo Download Manager HTTP Response Buffer Overflow
exploit/windows/browser/gom_openurl,GOM Player ActiveX Control Buffer Overflow
exploit/windows/browser/greendam_url,Green Dam URL Processing Buffer Overflow
exploit/windows/browser/honeywell_hscremotedeploy_exec,Honeywell HSC Remote Deployer ActiveX Remote Code Execution
exploit/windows/browser/honeywell_tema_exec,Honeywell Tema Remote Installer ActiveX Remote Code Execution
exploit/windows/browser/hp_alm_xgo_setshapenodetype_exec,HP Application Lifecycle Management XGO.ocx ActiveX SetShapeNodeType() Remote Code Execution
exploit/windows/browser/hp_easy_printer_care_xmlcachemgr,HP Easy Printer Care XMLCacheMgr Class ActiveX Control Remote Code Execution
exploit/windows/browser/hp_easy_printer_care_xmlsimpleaccessor,HP Easy Printer Care XMLSimpleAccessor Class ActiveX Control Remote Code Execution
exploit/windows/browser/hp_loadrunner_addfile,Persits XUpload ActiveX AddFile Buffer Overflow
exploit/windows/browser/hp_loadrunner_addfolder,HP LoadRunner 9.0 ActiveX AddFolder Buffer Overflow
exploit/windows/browser/hp_loadrunner_writefilebinary,HP LoadRunner lrFileIOService ActiveX Remote Code Execution
exploit/windows/browser/hp_loadrunner_writefilestring,HP LoadRunner lrFileIOService ActiveX WriteFileString Remote Code Execution
exploit/windows/browser/hpmqc_progcolor,HP Mercury Quality Center ActiveX Control ProgColor Buffer Overflow
exploit/windows/browser/hyleos_chemviewx_activex,Hyleos ChemView ActiveX Control Stack Buffer Overflow
exploit/windows/browser/ibm_spss_c1sizer,IBM SPSS SamplePower C1Tab ActiveX Heap Overflow
exploit/windows/browser/ibm_tivoli_pme_activex_bof,IBM Tivoli Provisioning Manager Express for Software Distribution Isig.isigCtl.1 ActiveX RunAndUploadFile() Method Overflow
exploit/windows/browser/ibmegath_getxmlvalue,IBM Access Support ActiveX Control Buffer Overflow
exploit/windows/browser/ibmlotusdomino_dwa_uploadmodule,IBM Lotus Domino Web Access Upload Module Buffer Overflow
exploit/windows/browser/ie_cbutton_uaf,MS13-008 Microsoft Internet Explorer CButton Object Use-After-Free Vulnerability
exploit/windows/browser/ie_cgenericelement_uaf,MS13-038 Microsoft Internet Explorer CGenericElement Object Use-After-Free Vulnerability
exploit/windows/browser/ie_createobject,MS06-014 Microsoft Internet Explorer COM CreateObject Code Execution
exploit/windows/browser/ie_execcommand_uaf,MS12-063 Microsoft Internet Explorer execCommand Use-After-Free Vulnerability 
exploit/windows/browser/ie_iscomponentinstalled,Microsoft Internet Explorer isComponentInstalled Overflow
exploit/windows/browser/ie_setmousecapture_uaf,MS13-080 Microsoft Internet Explorer SetMouseCapture Use-After-Free
exploit/windows/browser/ie_unsafe_scripting,Microsoft Internet Explorer Unsafe Scripting Misconfiguration
exploit/windows/browser/imgeviewer_tifmergemultifiles,Viscom Image Viewer CP Pro 8.0/Gold 6.0 ActiveX Control
exploit/windows/browser/indusoft_issymbol_internationalseparator,InduSoft Web Studio ISSymbol.ocx InternationalSeparator() Heap Overflow
exploit/windows/browser/inotes_dwa85w_bof,IBM Lotus iNotes dwa85W ActiveX Buffer Overflow
exploit/windows/browser/intrust_annotatex_add,Quest InTrust Annotation Objects Uninitialized Pointer
exploit/windows/browser/java_basicservice_impl,Sun Java Web Start BasicServiceImpl Code Execution
exploit/windows/browser/java_cmm,Java CMM Remote Code Execution
exploit/windows/browser/java_codebase_trust,Sun Java Applet2ClassLoader Remote Code Execution
exploit/windows/browser/java_docbase_bof,Sun Java Runtime New Plugin docbase Buffer Overflow
exploit/windows/browser/java_mixer_sequencer,Java MixerSequencer Object GM_Song Structure Handling Vulnerability
exploit/windows/browser/java_ws_arginject_altjvm,Sun Java Web Start Plugin Command Line Argument Injection
exploit/windows/browser/java_ws_double_quote,Sun Java Web Start Double Quote Injection
exploit/windows/browser/java_ws_vmargs,Sun Java Web Start Plugin Command Line Argument Injection
exploit/windows/browser/juniper_sslvpn_ive_setupdll,Juniper SSL-VPN IVE JuniperSetupDLL.dll ActiveX Control Buffer Overflow
exploit/windows/browser/kazaa_altnet_heap,Kazaa Altnet Download Manager ActiveX Control Buffer Overflow
exploit/windows/browser/keyhelp_launchtripane_exec,KeyHelp ActiveX LaunchTriPane Remote Code Execution Vulnerability
exploit/windows/browser/logitechvideocall_start,Logitech VideoCall ActiveX Control Buffer Overflow
exploit/windows/browser/lpviewer_url,iseemedia / Roxio / MGI Software LPViewer ActiveX Control Buffer Overflow
exploit/windows/browser/macrovision_downloadandexecute,Macrovision InstallShield Update Service Buffer Overflow
exploit/windows/browser/macrovision_unsafe,Macrovision InstallShield Update Service ActiveX Unsafe Method
exploit/windows/browser/malwarebytes_update_exec,Malwarebytes Anti-Malware and Anti-Exploit Update Remote Code Execution
exploit/windows/browser/maxthon_history_xcs,Maxthon3 about:history XCS Trusted Zone Code Execution
exploit/windows/browser/mcafee_mcsubmgr_vsprintf,McAfee Subscription Manager Stack Buffer Overflow
exploit/windows/browser/mcafee_mvt_exec,McAfee Virtual Technician MVTControl 6.3.0.1911 GetObject Vulnerability
exploit/windows/browser/mcafeevisualtrace_tracetarget,McAfee Visual Trace ActiveX Control Buffer Overflow
exploit/windows/browser/mirc_irc_url,mIRC IRC URL Buffer Overflow
exploit/windows/browser/mozilla_attribchildremoved,Firefox 8/9 AttributeChildRemoved() Use-After-Free
exploit/windows/browser/mozilla_firefox_onreadystatechange,Firefox onreadystatechange Event DocumentViewerImpl Use After Free
exploit/windows/browser/mozilla_firefox_xmlserializer,Firefox XMLSerializer Use After Free
exploit/windows/browser/mozilla_interleaved_write,Mozilla Firefox Interleaved document.write/appendChild Memory Corruption
exploit/windows/browser/mozilla_mchannel,Mozilla Firefox 3.6.16 mChannel Use-After-Free Vulnerability
exploit/windows/browser/mozilla_nssvgvalue,Firefox nsSVGValue Out-of-Bounds Access Vulnerability
exploit/windows/browser/mozilla_nstreerange,Mozilla Firefox "nsTreeRange" Dangling Pointer Vulnerability
exploit/windows/browser/mozilla_reduceright,Mozilla Firefox Array.reduceRight() Integer Overflow
exploit/windows/browser/ms03_020_ie_objecttype,MS03-020 Microsoft Internet Explorer Object Type
exploit/windows/browser/ms05_054_onload,MS05-054 Microsoft Internet Explorer JavaScript OnLoad Handler Remote Code Execution
exploit/windows/browser/ms06_001_wmf_setabortproc,Windows XP/2003/Vista Metafile Escape() SetAbortProc Code Execution
exploit/windows/browser/ms06_013_createtextrange,MS06-013 Microsoft Internet Explorer createTextRange() Code Execution
exploit/windows/browser/ms06_055_vml_method,MS06-055 Microsoft Internet Explorer VML Fill Method Code Execution
exploit/windows/browser/ms06_057_webview_setslice,MS06-057 Microsoft Internet Explorer WebViewFolderIcon setSlice() Overflow
exploit/windows/browser/ms06_067_keyframe,MS06-067 Microsoft Internet Explorer Daxctle.OCX KeyFrame Method Heap Buffer Overflow Vulnerability
exploit/windows/browser/ms06_071_xml_core,MS06-071 Microsoft Internet Explorer XML Core Services HTTP Request Handling
exploit/windows/browser/ms07_017_ani_loadimage_chunksize,Windows ANI LoadAniIcon() Chunk Size Stack Buffer Overflow (HTTP)
exploit/windows/browser/ms08_041_snapshotviewer,Snapshot Viewer for Microsoft Access ActiveX Control Arbitrary File Download
exploit/windows/browser/ms08_053_mediaencoder,Windows Media Encoder 9 wmex.dll ActiveX Buffer Overflow
exploit/windows/browser/ms08_070_visual_studio_msmask,Microsoft Visual Studio Mdmask32.ocx ActiveX Buffer Overflow
exploit/windows/browser/ms08_078_xml_corruption,MS08-078 Microsoft Internet Explorer Data Binding Memory Corruption
exploit/windows/browser/ms09_002_memory_corruption,MS09-002 Microsoft Internet Explorer 7 CFunctionPointer Uninitialized Memory Corruption
exploit/windows/browser/ms09_043_owc_htmlurl,Microsoft OWC Spreadsheet HTMLURL Buffer Overflow
exploit/windows/browser/ms09_043_owc_msdso,Microsoft OWC Spreadsheet msDataSourceObject Memory Corruption
exploit/windows/browser/ms09_072_style_object,MS09-072 Microsoft Internet Explorer Style getElementsByTagName Memory Corruption
exploit/windows/browser/ms10_002_aurora,MS10-002 Microsoft Internet Explorer "Aurora" Memory Corruption
exploit/windows/browser/ms10_002_ie_object,MS10-002 Microsoft Internet Explorer Object Memory Use-After-Free
exploit/windows/browser/ms10_018_ie_behaviors,MS10-018 Microsoft Internet Explorer DHTML Behaviors Use After Free
exploit/windows/browser/ms10_018_ie_tabular_activex,MS10-018 Microsoft Internet Explorer Tabular Data Control ActiveX Memory Corruption
exploit/windows/browser/ms10_022_ie_vbscript_winhlp32,MS10-022 Microsoft Internet Explorer Winhlp32.exe MsgBox Code Execution
exploit/windows/browser/ms10_026_avi_nsamplespersec,MS10-026 Microsoft MPEG Layer-3 Audio Stack Based Overflow
exploit/windows/browser/ms10_042_helpctr_xss_cmd_exec,Microsoft Help Center XSS and Command Execution
exploit/windows/browser/ms10_046_shortcut_icon_dllloader,Microsoft Windows Shell LNK Code Execution
exploit/windows/browser/ms10_090_ie_css_clip,MS10-090 Microsoft Internet Explorer CSS SetUserClip Memory Corruption
exploit/windows/browser/ms11_003_ie_css_import,MS11-003 Microsoft Internet Explorer CSS Recursive Import Use After Free
exploit/windows/browser/ms11_050_mshtml_cobjectelement,MS11-050 IE mshtml!CObjectElement Use After Free
exploit/windows/browser/ms11_081_option,MS11-081 Microsoft Internet Explorer Option Element Use-After-Free
exploit/windows/browser/ms11_093_ole32,MS11-093 Microsoft Windows OLE Object File Handling Remote Code Execution
exploit/windows/browser/ms12_004_midi,MS12-004 midiOutPlayNextPolyEvent Heap Overflow
exploit/windows/browser/ms12_037_ie_colspan,MS12-037 Microsoft Internet Explorer Fixed Table Col Span Heap Overflow
exploit/windows/browser/ms12_037_same_id,MS12-037 Microsoft Internet Explorer Same ID Property Deleted Object Handling Memory Corruption
exploit/windows/browser/ms13_009_ie_slayoutrun_uaf,MS13-009 Microsoft Internet Explorer SLayoutRun Use-After-Free
exploit/windows/browser/ms13_022_silverlight_script_object,MS13-022 Microsoft Silverlight ScriptObject Unsafe Memory Access
exploit/windows/browser/ms13_037_svg_dashstyle,MS13-037 Microsoft Internet Explorer COALineDashStyleArray Integer Overflow
exploit/windows/browser/ms13_037_textnode_uaf_praveend,MS13-037 Microsoft Internet Explorer textNode Use-After-Free
exploit/windows/browser/ms13_055_canchor,MS13-055 Microsoft Internet Explorer CAnchorElement Use-After-Free
exploit/windows/browser/ms13_059_cflatmarkuppointer,MS13-059 Microsoft Internet Explorer CFlatMarkupPointer Use-After-Free
exploit/windows/browser/ms13_069_caret,MS13-069 Microsoft Internet Explorer CCaret Use-After-Free
exploit/windows/browser/ms13_080_cdisplaypointer,MS13-080 Microsoft Internet Explorer CDisplayPointer Use-After-Free
exploit/windows/browser/ms13_090_cardspacesigninhelper,MS13-090 CardSpaceClaimCollection ActiveX Integer Underflow
exploit/windows/browser/ms14_012_cmarkup_uaf,MS14-012 Microsoft Internet Explorer CMarkup Use-After-Free
exploit/windows/browser/ms14_012_textrange,MS14-012 Microsoft Internet Explorer TextRange Use-After-Free
exploit/windows/browser/ms14_064_ole_code_execution,MS14-064 Microsoft Internet Explorer Windows OLE Automation Array Remote Code Execution
exploit/windows/browser/msvidctl_mpeg2,Microsoft DirectShow (msvidctl.dll) MPEG-2 Memory Corruption
exploit/windows/browser/mswhale_checkforupdates,Microsoft Whale Intelligent Application Gateway ActiveX Control Buffer Overflow
exploit/windows/browser/msxml_get_definition_code_exec,MS12-043 Microsoft XML Core Services MSXML Uninitialized Memory Corruption
exploit/windows/browser/nctaudiofile2_setformatlikesample,NCTAudioFile2 v2.x ActiveX Control SetFormatLikeSample() Buffer Overflow
exploit/windows/browser/nis2004_antispam,Norton AntiSpam 2004 SymSpamHelper ActiveX Control Buffer Overflow
exploit/windows/browser/nis2004_get,Symantec Norton Internet Security 2004 ActiveX Control Buffer Overflow
exploit/windows/browser/notes_handler_cmdinject,IBM Lotus Notes Client URL Handler Command Injection
exploit/windows/browser/novell_groupwise_gwcls1_actvx,Novell GroupWise Client gwcls1.dll ActiveX Remote Code Execution
exploit/windows/browser/novelliprint_callbackurl,Novell iPrint Client ActiveX Control call-back-url Buffer Overflow
exploit/windows/browser/novelliprint_datetime,Novell iPrint Client ActiveX Control Date/Time Buffer Overflow
exploit/windows/browser/novelliprint_executerequest,Novell iPrint Client ActiveX Control ExecuteRequest Buffer Overflow
exploit/windows/browser/novelliprint_executerequest_dbg,Novell iPrint Client ActiveX Control ExecuteRequest debug Buffer Overflow
exploit/windows/browser/novelliprint_getdriversettings,Novell iPrint Client ActiveX Control Buffer Overflow
exploit/windows/browser/novelliprint_getdriversettings_2,Novell iPrint Client ActiveX Control Buffer Overflow
exploit/windows/browser/novelliprint_target_frame,Novell iPrint Client ActiveX Control target-frame Buffer Overflow
exploit/windows/browser/ntr_activex_check_bof,NTR ActiveX Control Check() Method Buffer Overflow
exploit/windows/browser/ntr_activex_stopmodule,NTR ActiveX Control StopModule() Remote Code Execution
exploit/windows/browser/oracle_autovue_setmarkupmode,Oracle AutoVue ActiveX Control SetMarkupMode Buffer Overflow
exploit/windows/browser/oracle_dc_submittoexpress,Oracle Document Capture 10g ActiveX Control Buffer Overflow
exploit/windows/browser/oracle_webcenter_checkoutandopen,Oracle WebCenter Content CheckOutAndOpen.dll ActiveX Remote Code Execution
exploit/windows/browser/orbit_connecting,Orbit Downloader Connecting Log Creation Buffer Overflow
exploit/windows/browser/ovftool_format_string,VMWare OVF Tools Format String Vulnerability
exploit/windows/browser/pcvue_func,PcVue 10.0 SV.UIGrdCtrl.1 'LoadObject()/SaveObject()' Trusted DWORD Vulnerability
exploit/windows/browser/persits_xupload_traversal,Persits XUpload ActiveX MakeHttpRequest Directory Traversal
exploit/windows/browser/quickr_qp2_bof,IBM Lotus QuickR qp2 ActiveX Buffer Overflow
exploit/windows/browser/real_arcade_installerdlg,Real Networks Arcade Games StubbyUtil.ProcessMgr ActiveX Arbitrary Code Execution
exploit/windows/browser/realplayer_cdda_uri,RealNetworks RealPlayer CDDA URI Initialization Vulnerability
exploit/windows/browser/realplayer_console,RealPlayer rmoc3260.dll ActiveX Control Heap Corruption
exploit/windows/browser/realplayer_import,RealPlayer ierpplug.dll ActiveX Control Playlist Name Buffer Overflow
exploit/windows/browser/realplayer_qcp,RealNetworks Realplayer QCP Parsing Heap Overflow
exploit/windows/browser/realplayer_smil,RealNetworks RealPlayer SMIL Buffer Overflow
exploit/windows/browser/roxio_cineplayer,Roxio CinePlayer ActiveX Control Buffer Overflow
exploit/windows/browser/safari_xslt_output,Apple Safari Webkit libxslt Arbitrary File Creation
exploit/windows/browser/samsung_neti_wiewer_backuptoavi_bof,Samsung NET-i Viewer Multiple ActiveX BackupToAvi() Remote Overflow
exploit/windows/browser/sapgui_saveviewtosessionfile,SAP AG SAPgui EAI WebViewer3D Buffer Overflow
exploit/windows/browser/siemens_solid_edge_selistctrlx,Siemens Solid Edge ST4 SEListCtrlX ActiveX Remote Code Execution
exploit/windows/browser/softartisans_getdrivename,SoftArtisans XFile FileManager ActiveX Control Buffer Overflow
exploit/windows/browser/sonicwall_addrouteentry,SonicWall SSL-VPN NetExtender ActiveX Control Buffer Overflow
exploit/windows/browser/symantec_altirisdeployment_downloadandinstall,Symantec Altiris Deployment Solution ActiveX Control Arbitrary File Download and Execute
exploit/windows/browser/symantec_altirisdeployment_runcmd,Symantec Altiris Deployment Solution ActiveX Control Buffer Overflow
exploit/windows/browser/symantec_appstream_unsafe,Symantec AppStream LaunchObj ActiveX Control Arbitrary File Download and Execute
exploit/windows/browser/symantec_backupexec_pvcalendar,Symantec BackupExec Calendar Control Buffer Overflow
exploit/windows/browser/symantec_consoleutilities_browseandsavefile,Symantec ConsoleUtilities ActiveX Control Buffer Overflow
exploit/windows/browser/synactis_connecttosynactis_bof,Synactis PDF In-The-Box ConnectToSynactic Stack Buffer Overflow
exploit/windows/browser/systemrequirementslab_unsafe,Husdawg, LLC. System Requirements Lab ActiveX Unsafe Method
exploit/windows/browser/teechart_pro,TeeChart Professional ActiveX Control Trusted Integer Dereference
exploit/windows/browser/tom_sawyer_tsgetx71ex552,Tom Sawyer Software GET Extension Factory Remote Code Execution
exploit/windows/browser/trendmicro_extsetowner,Trend Micro Internet Security Pro 2010 ActiveX extSetOwner() Remote Code Execution
exploit/windows/browser/trendmicro_officescan,Trend Micro OfficeScan Client ActiveX Control Buffer Overflow
exploit/windows/browser/tumbleweed_filetransfer,Tumbleweed FileTransfer vcst_eu.dll ActiveX Control Buffer Overflow
exploit/windows/browser/ubisoft_uplay_cmd_exec,Ubisoft uplay 2.0.3 ActiveX Control Arbitrary Code Execution
exploit/windows/browser/ultramjcam_openfiledig_bof,TRENDnet SecurView Internet Camera UltraMJCam OpenFileDlg Buffer Overflow
exploit/windows/browser/ultraoffice_httpupload,Ultra Shareware Office Control ActiveX HttpUpload Buffer Overflow
exploit/windows/browser/verypdf_pdfview,VeryPDF PDFView OCX ActiveX OpenPDF Heap Overflow
exploit/windows/browser/viscom_movieplayer_drawtext,Viscom Software Movie Player Pro SDK ActiveX 6.8
exploit/windows/browser/vlc_amv,VLC AMV Dangling Pointer Vulnerability
exploit/windows/browser/vlc_mms_bof,VLC MMS Stream Handling Buffer Overflow
exploit/windows/browser/webdav_dll_hijacker,WebDAV Application DLL Hijacker
exploit/windows/browser/webex_ucf_newobject,WebEx UCF atucfobj.dll ActiveX NewObject Method Buffer Overflow
exploit/windows/browser/wellintech_kingscada_kxclientdownload,KingScada kxClientDownload.ocx ActiveX Remote Code Execution
exploit/windows/browser/winamp_playlist_unc,Winamp Playlist UNC Path Computer Name Overflow
exploit/windows/browser/winamp_ultravox,Winamp Ultravox Streaming Metadata (in_mp3.dll) Buffer Overflow
exploit/windows/browser/windvd7_applicationtype,WinDVD7 IASystemInfo.DLL ActiveX Control Buffer Overflow
exploit/windows/browser/winzip_fileview,WinZip FileView (WZFILEVIEW.FileViewCtrl.61) ActiveX Buffer Overflow
exploit/windows/browser/wmi_admintools,Microsoft WMI Administration Tools ActiveX Buffer Overflow
exploit/windows/browser/x360_video_player_set_text_bof,X360 VideoPlayer ActiveX Control Buffer Overflow
exploit/windows/browser/xmplay_asx,XMPlay 3.3.0.4 (ASX Filename) Buffer Overflow
exploit/windows/browser/yahoomessenger_fvcom,Yahoo! Messenger YVerInfo.dll ActiveX Control Buffer Overflow
exploit/windows/browser/yahoomessenger_server,Yahoo! Messenger 8.1.0.249 ActiveX Control Buffer Overflow
exploit/windows/browser/zenturiprogramchecker_unsafe,Zenturi ProgramChecker ActiveX Control Arbitrary File Download
exploit/windows/browser/zenworks_helplauncher_exec,AdminStudio LaunchHelp.dll ActiveX Arbitrary Code Execution
exploit/windows/dcerpc/ms03_026_dcom,MS03-026 Microsoft RPC DCOM Interface Overflow
exploit/windows/dcerpc/ms05_017_msmq,MS05-017 Microsoft Message Queueing Service Path Overflow
exploit/windows/dcerpc/ms07_029_msdns_zonename,MS07-029 Microsoft DNS RPC Service extractQuotedChar() Overflow (TCP)
exploit/windows/dcerpc/ms07_065_msmq,MS07-065 Microsoft Message Queueing Service DNS Name Path Overflow
exploit/windows/email/ms07_017_ani_loadimage_chunksize,Windows ANI LoadAniIcon() Chunk Size Stack Buffer Overflow (SMTP)
exploit/windows/email/ms10_045_outlook_ref_only,Outlook ATTACH_BY_REF_ONLY File Execution
exploit/windows/email/ms10_045_outlook_ref_resolve,Outlook ATTACH_BY_REF_RESOLVE File Execution
exploit/windows/emc/alphastor_agent,EMC AlphaStor Agent Buffer Overflow
exploit/windows/emc/alphastor_device_manager_exec,EMC AlphaStor Device Manager Opcode 0x75 Command Injection
exploit/windows/emc/networker_format_string,EMC Networker Format String
exploit/windows/emc/replication_manager_exec,EMC Replication Manager Command Execution
exploit/windows/fileformat/a_pdf_wav_to_mp3,A-PDF WAV to MP3 v1.0.0 Buffer Overflow
exploit/windows/fileformat/abbs_amp_lst,ABBS Audio Media Player .LST Buffer Overflow
exploit/windows/fileformat/acdsee_fotoslate_string,ACDSee FotoSlate PLP File id Parameter Overflow
exploit/windows/fileformat/acdsee_xpm,ACDSee XPM File Section Buffer Overflow
exploit/windows/fileformat/actfax_import_users_bof,ActiveFax (ActFax) 4.3 Client Importer Buffer Overflow
exploit/windows/fileformat/activepdf_webgrabber,activePDF WebGrabber ActiveX Control Buffer Overflow
exploit/windows/fileformat/adobe_collectemailinfo,Adobe Collab.collectEmailInfo() Buffer Overflow
exploit/windows/fileformat/adobe_cooltype_sing,Adobe CoolType SING Table "uniqueName" Stack Buffer Overflow
exploit/windows/fileformat/adobe_flashplayer_button,Adobe Flash Player "Button" Remote Code Execution
exploit/windows/fileformat/adobe_flashplayer_newfunction,Adobe Flash Player "newfunction" Invalid Pointer Use
exploit/windows/fileformat/adobe_flatedecode_predictor02,Adobe FlateDecode Stream Predictor 02 Integer Overflow
exploit/windows/fileformat/adobe_geticon,Adobe Collab.getIcon() Buffer Overflow
exploit/windows/fileformat/adobe_illustrator_v14_eps,Adobe Illustrator CS4 v14.0.0
exploit/windows/fileformat/adobe_jbig2decode,Adobe JBIG2Decode Memory Corruption
exploit/windows/fileformat/adobe_libtiff,Adobe Acrobat Bundled LibTIFF Integer Overflow
exploit/windows/fileformat/adobe_media_newplayer,Adobe Doc.media.newPlayer Use After Free Vulnerability
exploit/windows/fileformat/adobe_pdf_embedded_exe,Adobe PDF Embedded EXE Social Engineering
exploit/windows/fileformat/adobe_pdf_embedded_exe_nojs,Adobe PDF Escape EXE Social Engineering (No JavaScript)
exploit/windows/fileformat/adobe_reader_u3d,Adobe Reader U3D Memory Corruption Vulnerability
exploit/windows/fileformat/adobe_toolbutton,Adobe Reader ToolButton Use After Free
exploit/windows/fileformat/adobe_u3d_meshdecl,Adobe U3D CLODProgressiveMeshDeclaration Array Overrun
exploit/windows/fileformat/adobe_utilprintf,Adobe util.printf() Buffer Overflow
exploit/windows/fileformat/allplayer_m3u_bof,ALLPlayer M3U Buffer Overflow
exploit/windows/fileformat/altap_salamander_pdb,Altap Salamander 2.5 PE Viewer Buffer Overflow
exploit/windows/fileformat/aol_desktop_linktag,AOL Desktop 9.6 RTX Buffer Overflow
exploit/windows/fileformat/aol_phobos_bof,AOL 9.5 Phobos.Playlist Import() Stack-based Buffer Overflow
exploit/windows/fileformat/apple_quicktime_pnsize,Apple QuickTime PICT PnSize Buffer Overflow
exploit/windows/fileformat/apple_quicktime_rdrf,Apple Quicktime 7 Invalid Atom Length Buffer Overflow
exploit/windows/fileformat/apple_quicktime_texml,Apple QuickTime TeXML Style Element Stack Buffer Overflow
exploit/windows/fileformat/audio_coder_m3u,AudioCoder .M3U Buffer Overflow
exploit/windows/fileformat/audio_wkstn_pls,Audio Workstation 6.4.2.4.3 pls Buffer Overflow
exploit/windows/fileformat/audiotran_pls,Audiotran 1.4.1 (PLS File) Stack Buffer Overflow
exploit/windows/fileformat/audiotran_pls_1424,Audiotran PLS File Stack Buffer Overflow
