exploit/aix/local/ibstat_path,ibstat $PATH Privilege Escalation
exploit/multi/http/tomcat_mgr_upload,Apache Tomcat Manager Authenticated Upload Code Execution
exploit/multi/http/traq_plugin_exec,Traq admincp/common.php Remote Code Execution
exploit/multi/http/uptime_file_upload,Up.Time Monitoring Station post2file.php Arbitrary File Upload
exploit/multi/http/v0pcr3w_exec,v0pCr3w Web Shell Remote Code Execution
exploit/multi/http/vbseo_proc_deutf,vBSEO proc_deutf() Remote PHP Code Injection
exploit/multi/http/visual_mining_netcharts_upload,Visual Mining NetCharts Server Remote Code Execution
exploit/multi/http/vtiger_install_rce,Vtiger Install Unauthenticated Remote Command Execution
exploit/multi/http/vtiger_php_exec,vTigerCRM v5.4.0/v5.3.0 Authenticated Remote Code Execution
exploit/multi/http/vtiger_soap_upload,vTiger CRM SOAP AddEmailAttachment Arbitrary File Upload
exploit/multi/http/webpagetest_upload_exec,WebPageTest Arbitrary PHP File Upload
exploit/multi/http/wikka_spam_exec,WikkaWiki 1.3.2 Spam Logging PHP Injection
exploit/multi/http/x7chat2_php_exec,X7 Chat 2.0.5 lib/message.php preg_replace() PHP Code Execution
exploit/multi/http/zabbix_script_exec,Zabbix Authenticated Remote Command Execution
exploit/multi/http/zenworks_control_center_upload,Novell ZENworks Configuration Management Remote Execution
exploit/multi/ids/snort_dce_rpc,Snort 2 DCE/RPC Preprocessor Buffer Overflow
exploit/multi/misc/batik_svg_java,Squiggle 1.7 SVG Browser Java Code Execution
exploit/multi/misc/hp_data_protector_exec_integutil,HP Data Protector EXEC_INTEGUTIL Remote Code Execution
exploit/multi/misc/hp_vsa_exec,HP StorageWorks P4000 Virtual SAN Appliance Command Execution
exploit/multi/misc/indesign_server_soap,Adobe IndesignServer 5.5 SOAP Server Arbitrary Script Execution
exploit/multi/misc/java_jdwp_debugger,Java Debug Wire Protocol Remote Code Execution
exploit/multi/misc/java_jmx_server,Java JMX Server Insecure Configuration Java Code Execution
exploit/multi/misc/java_rmi_server,Java RMI Server Insecure Default Configuration Java Code Execution
exploit/multi/misc/openview_omniback_exec,HP OpenView OmniBack II Command Execution
exploit/multi/misc/pbot_exec,PHP IRC Bot pbot eval() Remote Code Execution
exploit/multi/misc/persistent_hpca_radexec_exec,HP Client Automation Command Injection
exploit/multi/misc/ra1nx_pubcall_exec,Ra1NX PHP Bot PubCall Authentication Bypass Remote Code Execution
exploit/multi/misc/veritas_netbackup_cmdexec,VERITAS NetBackup Remote Command Execution
exploit/multi/misc/wireshark_lwres_getaddrbyname,Wireshark LWRES Dissector getaddrsbyname_request Buffer Overflow
exploit/multi/misc/wireshark_lwres_getaddrbyname_loop,Wireshark LWRES Dissector getaddrsbyname_request Buffer Overflow (loop)
exploit/multi/misc/zend_java_bridge,Zend Server Java Bridge Arbitrary Java Code Execution
exploit/multi/ntp/ntp_overflow,NTP Daemon readvar Buffer Overflow
exploit/multi/php/php_unserialize_zval_cookie,PHP 4 unserialize() ZVAL Reference Counter Overflow (Cookie)
exploit/multi/realserver/describe,RealServer Describe Buffer Overflow
exploit/multi/samba/nttrans,Samba 2.2.2 - 2.2.6 nttrans Buffer Overflow
exploit/multi/samba/usermap_script,Samba "username map script" Command Execution
exploit/multi/sap/sap_mgmt_con_osexec_payload,SAP Management Console OSExecute Payload Execution
exploit/multi/sap/sap_soap_rfc_sxpg_call_system_exec,SAP SOAP RFC SXPG_CALL_SYSTEM Remote Command Execution
exploit/multi/sap/sap_soap_rfc_sxpg_command_exec,SAP SOAP RFC SXPG_COMMAND_EXECUTE Remote Command Execution
exploit/multi/script/web_delivery,Script Web Delivery
exploit/multi/ssh/sshexec,SSH User Code Execution
exploit/multi/svn/svnserve_date,Subversion Date Svnserve
exploit/multi/upnp/libupnp_ssdp_overflow,Portable UPnP SDK unique_service_name() Remote Code Execution
exploit/multi/vpn/tincd_bof,Tincd Post-Authentication Remote TCP Stack Buffer Overflow
exploit/multi/wyse/hagent_untrusted_hsdata,Wyse Rapport Hagent Fake Hserver Command Execution
exploit/netware/smb/lsass_cifs,Novell NetWare LSASS CIFS.NLM Driver Stack Buffer Overflow
exploit/netware/sunrpc/pkernel_callit,NetWare 6.5 SunRPC Portmapper CALLIT Stack Buffer Overflow
exploit/osx/afp/loginext,AppleFileServer LoginExt PathName Overflow
exploit/osx/arkeia/type77,Arkeia Backup Client Type 77 Overflow (Mac OS X)
exploit/osx/browser/mozilla_mchannel,Mozilla Firefox 3.6.16 mChannel Use-After-Free
exploit/osx/browser/safari_file_policy,Apple Safari file:// Arbitrary Code Execution
exploit/osx/browser/safari_metadata_archive,Safari Archive Metadata Command Execution
exploit/osx/browser/safari_user_assisted_download_launch,Safari User-Assisted Download and Run Attack
exploit/osx/browser/software_update,Apple OS X Software Update Command Execution
exploit/osx/email/mailapp_image_exec,Mail.app Image Attachment Command Execution
exploit/osx/ftp/webstar_ftp_user,WebSTAR FTP Server USER Overflow
exploit/osx/http/evocam_webserver,MacOS X EvoCam HTTP GET Buffer Overflow
exploit/osx/local/iokit_keyboard_root,Mac OS X IOKit Keyboard Driver Root Privilege Escalation
exploit/osx/local/nfs_mount_root,Mac OS X NFS Mount Privilege Escalation Exploit
exploit/osx/local/persistence,Mac OS X Persistent Payload Installer
exploit/osx/local/setuid_tunnelblick,Setuid Tunnelblick Privilege Escalation
exploit/osx/local/setuid_viscosity,Viscosity setuid-set ViscosityHelper Privilege Escalation
exploit/osx/local/sudo_password_bypass,Mac OS X Sudo Password Bypass
exploit/osx/local/vmware_bash_function_root,OS X VMWare Fusion Privilege Escalation via Bash Environment Code Injection
exploit/osx/mdns/upnp_location,Mac OS X mDNSResponder UPnP Location Overflow
exploit/osx/misc/ufo_ai,UFO: Alien Invasion IRC Client Buffer Overflow
exploit/osx/rtsp/quicktime_rtsp_content_type,MacOS X QuickTime RTSP Content-Type Overflow
exploit/osx/samba/lsa_transnames_heap,Samba lsa_io_trans_names Heap Overflow
exploit/osx/samba/trans2open,Samba trans2open Overflow (Mac OS X PPC)
exploit/pro/web/generic_exec,Generic Web Application Unix Command Execution
exploit/pro/web/http_put_asp,HTTP PUT ASP/.NET Upload
exploit/pro/web/http_put_php,Generic PHP Code Evaluation
exploit/pro/web/php_eval,Generic PHP Code Evaluation
exploit/pro/web/php_include,PHP Remote File Include Generic Code Execution
exploit/pro/web/sqli_mssql,SQL injection exploit for MSSQL
exploit/pro/web/sqli_mysql,SQL injection exploit for MySQL
exploit/pro/web/sqli_mysql_php,SQL injection exploit for MySQL
exploit/pro/web/sqli_postgres,SQL injection exploit for PostgreSQL
exploit/solaris/dtspcd/heap_noir,Solaris dtspcd Heap Overflow
exploit/solaris/lpd/sendmail_exec,Solaris LPD Command Execution
exploit/solaris/samba/lsa_transnames_heap,Samba lsa_io_trans_names Heap Overflow
exploit/solaris/samba/trans2open,Samba trans2open Overflow (Solaris SPARC)
exploit/solaris/sunrpc/sadmind_adm_build_path,Sun Solaris sadmind adm_build_path() Buffer Overflow
exploit/solaris/sunrpc/sadmind_exec,Solaris sadmind Command Execution
exploit/solaris/sunrpc/ypupdated_exec,Solaris ypupdated Command Execution
exploit/solaris/telnet/fuser,Sun Solaris Telnet Remote Authentication Bypass Vulnerability
exploit/solaris/telnet/ttyprompt,Solaris in.telnetd TTYPROMPT Buffer Overflow
exploit/unix/dhcp/bash_environment,Dhclient Bash Environment Variable Injection
exploit/unix/ftp/proftpd_133c_backdoor,ProFTPD-1.3.3c Backdoor Command Execution
exploit/unix/ftp/vsftpd_234_backdoor,VSFTPD v2.3.4 Backdoor Command Execution
exploit/unix/http/contentkeeperweb_mimencode,ContentKeeper Web Remote Command Execution
exploit/unix/http/ctek_skyrouter,CTEK SkyRouter 4200 and 4300 Command Execution
exploit/unix/http/freepbx_callmenum,FreePBX 2.10.0 / 2.9.0 callmenum Remote Code Execution
exploit/unix/http/lifesize_room,LifeSize Room Command Injection
exploit/unix/http/vmturbo_vmtadmin_exec_noauth,VMTurbo Operations Manager vmtadmin.cgi Remote Command Execution
exploit/unix/irc/unreal_ircd_3281_backdoor,UnrealIRCD 3.2.8.1 Backdoor Command Execution
exploit/unix/local/setuid_nmap,Setuid Nmap Exploit
exploit/unix/misc/distcc_exec,DistCC Daemon Command Execution
exploit/unix/misc/qnx_qconn_exec,QNX QCONN Remote Command Execution Vulnerability
exploit/unix/misc/spamassassin_exec,SpamAssassin spamd Remote Command Execution
exploit/unix/misc/xerox_mfp,Xerox Multifunction Printers (MFP) "Patch" DLM Vulnerability
exploit/unix/misc/zabbix_agent_exec,Zabbix Agent net.tcp.listen Command Injection
exploit/unix/smtp/clamav_milter_blackhole,ClamAV Milter Blackhole-Mode Remote Code Execution
exploit/unix/smtp/exim4_string_format,Exim4 string_format Function Heap Buffer Overflow
exploit/unix/ssh/array_vxag_vapv_privkey_privesc,Array Networks vAPV and vxAG Private Key Privilege Escalation Code Execution
exploit/unix/ssh/tectia_passwd_changereq,Tectia SSH USERAUTH Change Request Password Reset Vulnerability
exploit/unix/webapp/actualanalyzer_ant_cookie_exec,ActualAnalyzer 'ant' Cookie Command Execution
exploit/unix/webapp/arkeia_upload_exec,Western Digital Arkeia Remote Code Execution
exploit/unix/webapp/awstats_configdir_exec,AWStats configdir Remote Command Execution
exploit/unix/webapp/awstats_migrate_exec,AWStats migrate Remote Command Execution
exploit/unix/webapp/awstatstotals_multisort,AWStats Totals multisort Remote Command Execution
exploit/unix/webapp/barracuda_img_exec,Barracuda IMG.PL Remote Command Execution
exploit/unix/webapp/base_qry_common,BASE base_qry_common Remote File Include
exploit/unix/webapp/basilic_diff_exec,Basilic 1.5.14 diff.php Arbitrary Command Execution
exploit/unix/webapp/cacti_graphimage_exec,Cacti graph_view.php Remote Command Execution
exploit/unix/webapp/cakephp_cache_corruption,CakePHP Cache Corruption Code Execution
exploit/unix/webapp/carberp_backdoor_exec,Carberp Web Panel C2 Backdoor Remote PHP Code Execution
exploit/unix/webapp/citrix_access_gateway_exec,Citrix Access Gateway Command Execution
exploit/unix/webapp/clipbucket_upload_exec,ClipBucket Remote Code Execution
exploit/unix/webapp/coppermine_piceditor,Coppermine Photo Gallery picEditor.php Command Execution
exploit/unix/webapp/datalife_preview_exec,DataLife Engine preview.php PHP Code Injection
exploit/unix/webapp/dogfood_spell_exec,Dogfood CRM spell.php Remote Command Execution
exploit/unix/webapp/egallery_upload_exec,EGallery PHP File Upload Vulnerability
exploit/unix/webapp/flashchat_upload_exec,FlashChat Arbitrary File Upload
exploit/unix/webapp/foswiki_maketext,Foswiki MAKETEXT Remote Command Execution
exploit/unix/webapp/freepbx_config_exec,FreePBX config.php Remote Code Execution
exploit/unix/webapp/generic_exec,Generic Web Application Unix Command Execution
exploit/unix/webapp/get_simple_cms_upload_exec,GetSimpleCMS PHP File Upload Vulnerability
exploit/unix/webapp/google_proxystylesheet_exec,Google Appliance ProxyStyleSheet Command Execution
exploit/unix/webapp/graphite_pickle_exec,Graphite Web Unsafe Pickle Handling
exploit/unix/webapp/guestbook_ssi_exec,Matt Wright guestbook.pl Arbitrary Command Execution
exploit/unix/webapp/hastymail_exec,Hastymail 2.1.1 RC1 Command Injection
exploit/unix/webapp/havalite_upload_exec,Havalite CMS Arbitary File Upload Vulnerability
exploit/unix/webapp/horde_unserialize_exec,Horde Framework Unserialize PHP Code Execution
exploit/unix/webapp/hybridauth_install_php_exec,HybridAuth install.php PHP Code Execution
exploit/unix/webapp/instantcms_exec,InstantCMS 1.6 Remote PHP Code Execution
exploit/unix/webapp/invision_pboard_unserialize_exec,Invision IP.Board unserialize() PHP Code Execution
exploit/unix/webapp/joomla_akeeba_unserialize,Joomla Akeeba Kickstart Unserialize Remote Code Execution
exploit/unix/webapp/joomla_comjce_imgmanager,Joomla Component JCE File Upload Remote Code Execution
exploit/unix/webapp/joomla_media_upload_exec,Joomla Media Manager File Upload Vulnerability
exploit/unix/webapp/joomla_tinybrowser,Joomla 1.5.12 TinyBrowser File Upload Code Execution
exploit/unix/webapp/kimai_sqli,Kimai v0.9.2 'db_restore.php' SQL Injection
exploit/unix/webapp/libretto_upload_exec,LibrettoCMS File Manager Arbitary File Upload Vulnerability
exploit/unix/webapp/maarch_letterbox_file_upload,Maarch LetterBox Unrestricted File Upload
exploit/unix/webapp/mambo_cache_lite,Mambo Cache_Lite Class mosConfig_absolute_path Remote File Include
exploit/unix/webapp/mitel_awc_exec,Mitel Audio and Web Conferencing Command Injection
exploit/unix/webapp/moinmoin_twikidraw,MoinMoin twikidraw Action Traversal File Upload
exploit/unix/webapp/mybb_backdoor,myBB 1.6.4 Backdoor Arbitrary Command Execution
exploit/unix/webapp/nagios3_history_cgi,Nagios3 history.cgi Host Command Execution
exploit/unix/webapp/nagios3_statuswml_ping,Nagios3 statuswml.cgi Ping Command Execution
exploit/unix/webapp/nagios_graph_explorer,Nagios XI Network Monitor Graph Explorer Component Command Injection
exploit/unix/webapp/narcissus_backend_exec,Narcissus Image Configuration Passthru Vulnerability
exploit/unix/webapp/open_flash_chart_upload_exec,Open Flash Chart v2 Arbitrary File Upload
exploit/unix/webapp/openemr_sqli_privesc_upload,OpenEMR 4.1.1 Patch 14 SQLi Privilege Escalation Remote Code Execution
exploit/unix/webapp/openemr_upload_exec,OpenEMR PHP File Upload Vulnerability
exploit/unix/webapp/opensis_modname_exec,OpenSIS 'modname' PHP Code Execution
exploit/unix/webapp/openview_connectednodes_exec,HP Openview connectedNodes.ovpl Remote Command Execution
exploit/unix/webapp/openx_banner_edit,OpenX banner-edit.php File Upload PHP Code Execution
exploit/unix/webapp/oracle_vm_agent_utl,Oracle VM Server Virtual Server Agent Command Injection
exploit/unix/webapp/oscommerce_filemanager,osCommerce 2.2 Arbitrary PHP Code Execution
exploit/unix/webapp/pajax_remote_exec,PAJAX Remote Command Execution
exploit/unix/webapp/php_charts_exec,PHP-Charts v1.0 PHP Code Execution Vulnerability
exploit/unix/webapp/php_eval,Generic PHP Code Evaluation
exploit/unix/webapp/php_include,PHP Remote File Include Generic Code Execution
exploit/unix/webapp/php_vbulletin_template,vBulletin misc.php Template Name Arbitrary Code Execution
exploit/unix/webapp/php_wordpress_foxypress,WordPress Plugin Foxypress uploadify.php Arbitrary Code Execution
exploit/unix/webapp/php_wordpress_infusionsoft,Wordpress InfusionSoft Upload Vulnerability
exploit/unix/webapp/php_wordpress_lastpost,WordPress cache_lastpostdate Arbitrary Code Execution
exploit/unix/webapp/php_wordpress_optimizepress,WordPress OptimizePress Theme File Upload Vulnerability
exploit/unix/webapp/php_wordpress_total_cache,Wordpress W3 Total Cache PHP Code Execution
exploit/unix/webapp/php_xmlrpc_eval,PHP XML-RPC Arbitrary Code Execution
exploit/unix/webapp/phpbb_highlight,phpBB viewtopic.php Arbitrary Code Execution
exploit/unix/webapp/phpmyadmin_config,PhpMyAdmin Config File Code Injection
exploit/unix/webapp/projectpier_upload_exec,Project Pier Arbitrary File Upload Vulnerability
exploit/unix/webapp/projectsend_upload_exec,ProjectSend Arbitrary File Upload
exploit/unix/webapp/qtss_parse_xml_exec,QuickTime Streaming Server parse_xml.cgi Remote Execution
exploit/unix/webapp/redmine_scm_exec,Redmine SCM Repository Arbitrary Command Execution
exploit/unix/webapp/seportal_sqli_exec,SePortal SQLi Remote Code Execution
exploit/unix/webapp/simple_e_document_upload_exec,Simple E-Document Arbitrary File Upload
exploit/unix/webapp/skybluecanvas_exec,SkyBlueCanvas CMS Remote Code Execution
exploit/unix/webapp/sphpblog_file_upload,Simple PHP Blog Remote Command Execution
exploit/unix/webapp/spip_connect_exec,SPIP connect Parameter PHP Injection
exploit/unix/webapp/squash_yaml_exec,Squash YAML Code Execution
exploit/unix/webapp/squirrelmail_pgp_plugin,SquirrelMail PGP Plugin Command Execution (SMTP)
exploit/unix/webapp/sugarcrm_unserialize_exec,SugarCRM unserialize() PHP Code Execution
exploit/unix/webapp/tikiwiki_graph_formula_exec,TikiWiki tiki-graph_formula Remote PHP Code Execution
exploit/unix/webapp/tikiwiki_jhot_exec,TikiWiki jhot Remote Command Execution
exploit/unix/webapp/tikiwiki_unserialize_exec,Tiki Wiki unserialize() PHP Code Execution
exploit/unix/webapp/trixbox_langchoice,Trixbox langChoice PHP Local File Inclusion
exploit/unix/webapp/tuleap_unserialize_exec,Tuleap PHP Unserialize Code Execution
exploit/unix/webapp/twiki_history,TWiki History TWikiUsers rev Parameter Command Execution
exploit/unix/webapp/twiki_maketext,TWiki MAKETEXT Remote Command Execution
exploit/unix/webapp/twiki_search,TWiki Search Function Arbitrary Command Execution
exploit/unix/webapp/vbulletin_vote_sqli_exec,vBulletin index.php/ajax/api/reputation/vote nodeid Parameter SQL Injection
exploit/unix/webapp/vicidial_manager_send_cmd_exec,VICIdial Manager Send OS Command Injection
exploit/unix/webapp/webmin_show_cgi_exec,Webmin /file/show.cgi Remote Command Execution
exploit/unix/webapp/webtester_exec,WebTester 5.x Command Execution
exploit/unix/webapp/wp_admin_shell_upload,WordPress Admin Shell Upload
exploit/unix/webapp/wp_advanced_custom_fields_exec,WordPress Plugin Advanced Custom Fields Remote File Inclusion
exploit/unix/webapp/wp_asset_manager_upload_exec,WordPress Asset-Manager PHP File Upload Vulnerability
exploit/unix/webapp/wp_downloadmanager_upload,Wordpress Download Manager (download-manager) Unauthenticated File Upload
exploit/unix/webapp/wp_easycart_unrestricted_file_upload,WordPress WP EasyCart Unrestricted File Upload
exploit/unix/webapp/wp_google_document_embedder_exec,WordPress Plugin Google Document Embedder Arbitrary File Disclosure
exploit/unix/webapp/wp_holding_pattern_file_upload,WordPress Holding Pattern Theme Arbitrary File Upload
exploit/unix/webapp/wp_photo_gallery_unrestricted_file_upload,WordPress Photo Gallery Unrestricted File Upload
exploit/unix/webapp/wp_pixabay_images_upload,WordPress Pixabay Images PHP Code Upload
exploit/unix/webapp/wp_platform_exec,Remote Code Execution in WordPress Platform Theme
exploit/unix/webapp/wp_property_upload_exec,WordPress WP-Property PHP File Upload Vulnerability
exploit/unix/webapp/wp_symposium_shell_upload,WordPress WP Symposium 14.11 Shell Upload
exploit/unix/webapp/wp_wptouch_file_upload,Wordpress WPTouch Authenticated File Upload
exploit/unix/webapp/wp_wysija_newsletters_upload,Wordpress MailPoet Newsletters (wysija-newsletters) Unauthenticated File Upload
exploit/unix/webapp/xoda_file_upload,XODA 0.4.5 Arbitrary PHP File Upload Vulnerability
exploit/unix/webapp/zeroshell_exec,ZeroShell Remote Code Execution
exploit/unix/webapp/zimbra_lfi,Zimbra Collaboration Server LFI
exploit/unix/webapp/zoneminder_packagecontrol_exec,ZoneMinder Video Server packageControl Command Execution
exploit/unix/webapp/zpanel_username_exec,ZPanel 10.0.0.2 htpasswd Module Username Command Execution
exploit/windows/antivirus/ams_hndlrsvc,Symantec System Center Alert Management System (hndlrsvc.exe) Arbitrary Command Execution
exploit/windows/antivirus/ams_xfr,Symantec System Center Alert Management System (xfr.exe) Arbitrary Command Execution
exploit/windows/antivirus/symantec_endpoint_manager_rce,Symantec Endpoint Protection Manager Remote Command Execution
exploit/windows/antivirus/symantec_iao,Symantec Alert Management System Intel Alert Originator Service Buffer Overflow
exploit/windows/antivirus/symantec_rtvscan,Symantec Remote Management Buffer Overflow
exploit/windows/antivirus/symantec_workspace_streaming_exec,Symantec Workspace Streaming Arbitrary File Upload
exploit/windows/antivirus/trendmicro_serverprotect,Trend Micro ServerProtect 5.58 Buffer Overflow
exploit/windows/antivirus/trendmicro_serverprotect_createbinding,Trend Micro ServerProtect 5.58 CreateBinding() Buffer Overflow
exploit/windows/antivirus/trendmicro_serverprotect_earthagent,Trend Micro ServerProtect 5.58 EarthAgent.EXE Buffer Overflow
exploit/windows/arkeia/type77,Arkeia Backup Client Type 77 Overflow (Win32)
exploit/windows/backdoor/energizer_duo_payload,Energizer DUO Trojan Code Execution
exploit/windows/backupexec/name_service,Veritas Backup Exec Name Service Overflow
exploit/windows/backupexec/remote_agent,Veritas Backup Exec Windows Remote Agent Overflow
exploit/windows/brightstor/ca_arcserve_342,Computer Associates ARCserve REPORTREMOTEEXECUTECML Buffer Overflow
exploit/windows/brightstor/discovery_tcp,CA BrightStor Discovery Service TCP Overflow
exploit/windows/brightstor/discovery_udp,CA BrightStor Discovery Service Stack Buffer Overflow
exploit/windows/brightstor/etrust_itm_alert,Computer Associates Alert Notification Buffer Overflow
exploit/windows/brightstor/hsmserver,CA BrightStor HSM Buffer Overflow
exploit/windows/brightstor/lgserver,CA BrightStor ARCserve for Laptops and Desktops LGServer Buffer Overflow
exploit/windows/brightstor/lgserver_multi,CA BrightStor ARCserve for Laptops and Desktops LGServer Multiple Commands Buffer Overflow
exploit/windows/brightstor/lgserver_rxrlogin,CA BrightStor ARCserve for Laptops and Desktops LGServer Buffer Overflow
exploit/windows/brightstor/lgserver_rxssetdatagrowthscheduleandfilter,CA BrightStor ARCserve for Laptops and Desktops LGServer rxsSetDataGrowthScheduleAndFilter Buffer Overflow
exploit/windows/brightstor/lgserver_rxsuselicenseini,CA BrightStor ARCserve for Laptops and Desktops LGServer Buffer Overflow
exploit/windows/brightstor/license_gcr,CA BrightStor ARCserve License Service GCR NETWORK Buffer Overflow
exploit/windows/brightstor/mediasrv_sunrpc,CA BrightStor ArcServe Media Service Stack Buffer Overflow
exploit/windows/brightstor/message_engine,CA BrightStor ARCserve Message Engine Buffer Overflow
exploit/windows/brightstor/message_engine_72,CA BrightStor ARCserve Message Engine 0x72 Buffer Overflow
exploit/windows/brightstor/message_engine_heap,CA BrightStor ARCserve Message Engine Heap Overflow
exploit/windows/brightstor/sql_agent,CA BrightStor Agent for Microsoft SQL Overflow
exploit/windows/brightstor/tape_engine,CA BrightStor ARCserve Tape Engine Buffer Overflow
exploit/windows/brightstor/tape_engine_0x8a,CA BrightStor ARCserve Tape Engine 0x8A Buffer Overflow
exploit/windows/brightstor/universal_agent,CA BrightStor Universal Agent Overflow
exploit/windows/browser/adobe_cooltype_sing,Adobe CoolType SING Table "uniqueName" Stack Buffer Overflow
exploit/windows/browser/adobe_flash_avm2,Adobe Flash Player Integer Underflow Remote Code Execution
exploit/windows/browser/adobe_flash_filters_type_confusion,Adobe Flash Player Type Confusion Remote Code Execution
exploit/windows/browser/adobe_flash_mp4_cprt,Adobe Flash Player MP4 'cprt' Overflow
exploit/windows/browser/adobe_flash_otf_font,Adobe Flash Player 11.3 Kern Table Parsing Integer Overflow
exploit/windows/browser/adobe_flash_pixel_bender_bof,Adobe Flash Player Shader Buffer Overflow
exploit/windows/browser/adobe_flash_regex_value,Adobe Flash Player Regular Expression Heap Overflow
exploit/windows/browser/adobe_flash_rtmp,Adobe Flash Player Object Type Confusion
exploit/windows/browser/adobe_flash_sps,Adobe Flash Player MP4 SequenceParameterSetNALUnit Buffer Overflow
exploit/windows/browser/adobe_flashplayer_arrayindexing,Adobe Flash Player AVM Verification Logic Array Indexing Code Execution
exploit/windows/browser/adobe_flashplayer_avm,Adobe Flash Player AVM Bytecode Verification Vulnerability
exploit/windows/browser/adobe_flashplayer_flash10o,Adobe Flash Player 10.2.153.1 SWF Memory Corruption Vulnerability
exploit/windows/browser/adobe_flashplayer_newfunction,Adobe Flash Player "newfunction" Invalid Pointer Use
exploit/windows/browser/adobe_flatedecode_predictor02,Adobe FlateDecode Stream Predictor 02 Integer Overflow
exploit/windows/browser/adobe_geticon,Adobe Collab.getIcon() Buffer Overflow
exploit/windows/browser/adobe_jbig2decode,Adobe JBIG2Decode Heap Corruption
exploit/windows/browser/adobe_media_newplayer,Adobe Doc.media.newPlayer Use After Free Vulnerability
exploit/windows/browser/adobe_shockwave_rcsl_corruption,Adobe Shockwave rcsL Memory Corruption
exploit/windows/browser/adobe_toolbutton,Adobe Reader ToolButton Use After Free
exploit/windows/browser/adobe_utilprintf,Adobe util.printf() Buffer Overflow
exploit/windows/browser/advantech_webaccess_dvs_getcolor,Advantech WebAccess dvs.ocx GetColor Buffer Overflow
exploit/windows/browser/aim_goaway,AOL Instant Messenger goaway Overflow
exploit/windows/browser/aladdin_choosefilepath_bof,Aladdin Knowledge System Ltd ChooseFilePath Buffer Overflow
exploit/windows/browser/amaya_bdo,Amaya Browser v11.0 'bdo' Tag Overflow
exploit/windows/browser/aol_ampx_convertfile,AOL Radio AmpX ActiveX Control ConvertFile() Buffer Overflow
exploit/windows/browser/aol_icq_downloadagent,America Online ICQ ActiveX Control Arbitrary File Download and Execute
exploit/windows/browser/apple_itunes_playlist,Apple ITunes 4.7 Playlist Buffer Overflow
exploit/windows/browser/apple_quicktime_marshaled_punk,Apple QuickTime 7.6.7 _Marshaled_pUnk Code Execution
exploit/windows/browser/apple_quicktime_mime_type,Apple QuickTime 7.7.2 MIME Type Buffer Overflow
exploit/windows/browser/apple_quicktime_rdrf,Apple Quicktime 7 Invalid Atom Length Buffer Overflow
exploit/windows/browser/apple_quicktime_rtsp,Apple QuickTime 7.1.3 RTSP URI Buffer Overflow
exploit/windows/browser/apple_quicktime_smil_debug,Apple QuickTime 7.6.6 Invalid SMIL URI Buffer Overflow
exploit/windows/browser/apple_quicktime_texml_font_table,Apple QuickTime 7.7.2 TeXML Style Element font-table Field Stack Buffer Overflow
exploit/windows/browser/ask_shortformat,Ask.com Toolbar askBar.dll ActiveX Control Buffer Overflow
exploit/windows/browser/asus_net4switch_ipswcom,ASUS Net4Switch ipswcom.dll ActiveX Stack Buffer Overflow
exploit/windows/browser/athocgov_completeinstallation,AtHocGov IWSAlerts ActiveX Control Buffer Overflow
exploit/windows/browser/autodesk_idrop,Autodesk IDrop ActiveX Control Heap Memory Corruption
exploit/windows/browser/aventail_epi_activex,SonicWALL Aventail epi.dll AuthCredential Format String
exploit/windows/browser/awingsoft_web3d_bof,AwingSoft Winds3D Player SceneURL Buffer Overflow
