exploit/aix/local/ibstat_path,ibstat $PATH Privilege Escalation
exploit/aix/rpc_cmsd_opcode21,AIX Calendar Manager Service Daemon (rpc.cmsd) Opcode 21 Buffer Overflow
exploit/aix/rpc_ttdbserverd_realpath,ToolTalk rpc.ttdbserverd _tt_internal_realpath Buffer Overflow (AIX)
exploit/android/browser/samsung_knox_smdm_url,Samsung Galaxy KNOX Android Browser RCE
exploit/android/browser/webview_addjavascriptinterface,Android Browser and WebView addJavascriptInterface Code Execution
exploit/android/fileformat/adobe_reader_pdf_js_interface,Adobe Reader for Android addJavascriptInterface Exploit
exploit/android/local/futex_requeue,Android 'Towelroot' Futex Requeue Kernel Exploit
exploit/apple_ios/browser/safari_libtiff,Apple iOS MobileSafari LibTIFF Buffer Overflow
exploit/apple_ios/email/mobilemail_libtiff,Apple iOS MobileMail LibTIFF Buffer Overflow
exploit/apple_ios/ssh/cydia_default_ssh,Apple iOS Default SSH Password Vulnerability
exploit/bsdi/softcart/mercantec_softcart,Mercantec SoftCart CGI Overflow
exploit/dialup/multi/login/manyargs,System V Derived /bin/login Extraneous Arguments Buffer Overflow
exploit/firefox/local/exec_shellcode,Firefox Exec Shellcode from Privileged Javascript Shell
exploit/freebsd/ftp/proftp_telnet_iac,ProFTPD 1.3.2rc3 - 1.3.3b Telnet IAC Buffer Overflow (FreeBSD)
exploit/freebsd/local/mmap,FreeBSD 9 Address Space Manipulation Privilege Escalation
exploit/freebsd/misc/citrix_netscaler_soap_bof,Citrix NetScaler SOAP Handler Remote Code Execution
exploit/freebsd/samba/trans2open,Samba trans2open Overflow (*BSD x86)
exploit/freebsd/tacacs/xtacacsd_report,XTACACSD report() Buffer Overflow
exploit/freebsd/telnet/telnet_encrypt_keyid,FreeBSD Telnet Service Encryption Key ID Buffer Overflow
exploit/hpux/lpd/cleanup_exec,HP-UX LPD Command Execution
exploit/irix/lpd/tagprinter_exec,Irix LPD tagprinter Command Execution
exploit/linux/antivirus/escan_password_exec,eScan Web Management Console Command Injection
exploit/linux/browser/adobe_flashplayer_aslaunch,Adobe Flash Player ActionScript Launch Command Execution Vulnerability
exploit/linux/ftp/proftp_sreplace,ProFTPD 1.2 - 1.3.0 sreplace Buffer Overflow (Linux)
exploit/linux/ftp/proftp_telnet_iac,ProFTPD 1.3.2rc3 - 1.3.3b Telnet IAC Buffer Overflow (Linux)
exploit/linux/games/ut2004_secure,Unreal Tournament 2004 "secure" Overflow (Linux)
exploit/linux/http/alcatel_omnipcx_mastercgi_exec,Alcatel-Lucent OmniPCX Enterprise masterCGI Arbitrary Command Execution
exploit/linux/http/alienvault_sqli_exec,AlienVault OSSIM SQL Injection and Remote Code Execution
exploit/linux/http/astium_sqli_upload,Astium Remote Code Execution
exploit/linux/http/centreon_sqli_exec,Centreon SQL and Command Injection
exploit/linux/http/cfme_manageiq_evm_upload_exec,Red Hat CloudForms Management Engine 5.1 agent/linuxpkgs Path Traversal
exploit/linux/http/ddwrt_cgibin_exec,DD-WRT HTTP Daemon Arbitrary Command Execution
exploit/linux/http/dlink_authentication_cgi_bof,D-Link authentication.cgi Buffer Overflow
exploit/linux/http/dlink_command_php_exec_noauth,D-Link Devices Unauthenticated Remote Command Execution
exploit/linux/http/dlink_diagnostic_exec_noauth,D-Link DIR-645 / DIR-815 diagnostic.php Command Execution
exploit/linux/http/dlink_dir300_exec_telnet,D-Link Devices Unauthenticated Remote Command Execution
exploit/linux/http/dlink_dir605l_captcha_bof,D-Link DIR-605L Captcha Handling Buffer Overflow
exploit/linux/http/dlink_dir615_up_exec,D-Link DIR615h OS Command Injection
exploit/linux/http/dlink_dspw215_info_cgi_bof,D-Link info.cgi POST Request Buffer Overflow
exploit/linux/http/dlink_hedwig_cgi_bof,D-Link hedwig.cgi Buffer Overflow in Cookie Header
exploit/linux/http/dlink_hnap_bof,D-Link HNAP Request Remote Buffer Overflow
exploit/linux/http/dlink_upnp_exec_noauth,D-Link Devices UPnP SOAP Command Execution
exploit/linux/http/dolibarr_cmd_exec,Dolibarr ERP/CRM Post-Auth OS Command Injection
exploit/linux/http/dreambox_openpli_shell,OpenPLI Webif Arbitrary Command Execution
exploit/linux/http/esva_exec,E-Mail Security Virtual Appliance learn-msg.cgi Command Injection
exploit/linux/http/f5_icontrol_exec,F5 iControl Remote Root Command Execution
exploit/linux/http/foreman_openstack_satellite_code_exec,Foreman (Red Hat OpenStack/Satellite) bookmarks/create Code Injection
exploit/linux/http/fritzbox_echo_exec,Fritz!Box Webcm Unauthenticated Command Injection
exploit/linux/http/gitlist_exec,Gitlist Unauthenticated Remote Command Execution
exploit/linux/http/gpsd_format_string,Berlios GPSD Format String Vulnerability
exploit/linux/http/groundwork_monarch_cmd_exec,GroundWork monarch_scan.cgi OS Command Injection
exploit/linux/http/hp_system_management,HP System Management Anonymous Access Code Execution
exploit/linux/http/kloxo_sqli,Kloxo SQL Injection and Remote Code Execution
exploit/linux/http/lifesize_uvc_ping_rce,LifeSize UVC Authenticated RCE via Ping
exploit/linux/http/linksys_apply_cgi,Linksys WRT54 Access Point apply.cgi Buffer Overflow
exploit/linux/http/linksys_e1500_apply_exec,Linksys E1500/E2500 apply.cgi Remote Command Injection
exploit/linux/http/linksys_themoon_exec,Linksys E-Series TheMoon Remote Command Injection
exploit/linux/http/linksys_wrt110_cmd_exec,Linksys Devices pingstr Remote Command Injection
exploit/linux/http/linksys_wrt160nv2_apply_exec,Linksys WRT160nv2 apply.cgi Remote Command Injection
exploit/linux/http/linksys_wrt54gl_apply_exec,Linksys WRT54GL apply.cgi Command Execution
exploit/linux/http/mutiny_frontend_upload,Mutiny 5 Arbitrary File Upload
exploit/linux/http/netgear_dgn1000b_setup_exec,Netgear DGN1000B setup.cgi Remote Command Execution
exploit/linux/http/netgear_dgn2200b_pppoe_exec,Netgear DGN2200B pppoe.cgi Remote Command Execution
exploit/linux/http/netgear_readynas_exec,NETGEAR ReadyNAS Perl Code Evaluation
exploit/linux/http/nginx_chunked_size,Nginx HTTP Server 1.3.9-1.4.0 Chunked Encoding Stack Buffer Overflow
exploit/linux/http/openfiler_networkcard_exec,Openfiler v2.x NetworkCard Command Execution
exploit/linux/http/pandora_fms_exec,Pandora FMS Remote Code Execution
exploit/linux/http/pandora_fms_sqli,Pandora FMS Default Credential / SQLi Remote Code Execution
exploit/linux/http/peercast_url,PeerCast URL Handling Buffer Overflow
exploit/linux/http/pineapp_ldapsyncnow_exec,PineApp Mail-SeCure ldapsyncnow.php Arbitrary Command Execution
exploit/linux/http/pineapp_livelog_exec,PineApp Mail-SeCure livelog.html Arbitrary Command Execution
exploit/linux/http/pineapp_test_li_conn_exec,PineApp Mail-SeCure test_li_connection.php Arbitrary Command Execution
exploit/linux/http/piranha_passwd_exec,RedHat Piranha Virtual Server Package passwd.php3 Arbitrary Command Execution
exploit/linux/http/raidsonic_nas_ib5220_exec_noauth,Raidsonic NAS Devices Unauthenticated Remote Command Execution
exploit/linux/http/railo_cfml_rfi,Railo Remote File Include
exploit/linux/http/seagate_nas_php_exec_noauth,Seagate Business NAS Unauthenticated Remote Command Execution
exploit/linux/http/smt_ipmi_close_window_bof,Supermicro Onboard IPMI close_window.cgi Buffer Overflow
exploit/linux/http/sophos_wpa_iface_exec,Sophos Web Protection Appliance Interface Authenticated Arbitrary Command Execution
exploit/linux/http/sophos_wpa_sblistpack_exec,Sophos Web Protection Appliance sblistpack Arbitrary Command Execution
exploit/linux/http/symantec_web_gateway_exec,Symantec Web Gateway 5.0.2.8 ipchange.php Command Injection
exploit/linux/http/symantec_web_gateway_file_upload,Symantec Web Gateway 5.0.2.8 Arbitrary PHP File Upload Vulnerability
exploit/linux/http/symantec_web_gateway_lfi,Symantec Web Gateway 5.0.2.8 relfile File Inclusion Vulnerability
exploit/linux/http/symantec_web_gateway_pbcontrol,Symantec Web Gateway 5.0.2.18 pbcontrol.php Command Injection
exploit/linux/http/symantec_web_gateway_restore,Symantec Web Gateway 5 restore.php Post Authentication Command Injection
exploit/linux/http/synology_dsm_sliceupload_exec_noauth,Synology DiskStation Manager SLICEUPLOAD Remote Command Execution
exploit/linux/http/vap2500_tools_command_exec,Arris VAP2500 tools_command.php Command Execution
exploit/linux/http/vcms_upload,V-CMS PHP File Upload and Execute
exploit/linux/http/wanem_exec,WAN Emulator v2.3 Command Execution
exploit/linux/http/webcalendar_settings_exec,WebCalendar 1.2.4 Pre-Auth Remote Code Injection
exploit/linux/http/webid_converter,WeBid converter.php Remote PHP Code Injection
exploit/linux/http/zabbix_sqli,Zabbix 2.0.8 SQL Injection and Remote Code Execution
exploit/linux/http/zen_load_balancer_exec,ZEN Load Balancer Filelog Command Execution
exploit/linux/http/zenoss_showdaemonxmlconfig_exec,Zenoss 3 showDaemonXMLConfig Command Execution
exploit/linux/ids/alienvault_centerd_soap_exec,AlienVault OSSIM av-centerd Command Injection
exploit/linux/ids/snortbopre,Snort Back Orifice Pre-Preprocessor Buffer Overflow
exploit/linux/imap/imap_uw_lsub,UoW IMAP Server LSUB Buffer Overflow
exploit/linux/local/desktop_privilege_escalation,Desktop Linux Password Stealer and Privilege Escalation
exploit/linux/local/hp_smhstart,HP System Management Homepage Local Privilege Escalation
exploit/linux/local/kloxo_lxsuexec,Kloxo Local Privilege Escalation
exploit/linux/local/pkexec,Linux PolicyKit Race Condition Privilege Escalation
exploit/linux/local/sock_sendpage,Linux Kernel Sendpage Local Privilege Escalation
exploit/linux/local/sophos_wpa_clear_keys,Sophos Web Protection Appliance clear_keys.pl Local Privilege Escalation
exploit/linux/local/udev_netlink,Linux udev Netlink Local Privilege Escalation
exploit/linux/local/vmware_mount,VMWare Setuid vmware-mount Unsafe popen(3)
exploit/linux/local/zpanel_zsudo,ZPanel zsudo Local Privilege Escalation Exploit
exploit/linux/misc/accellion_fta_mpipe2,Accellion File Transfer Appliance MPIPE2 Command Execution
exploit/linux/misc/drb_remote_codeexec,Distributed Ruby Send instance_eval/syscall Code Execution
exploit/linux/misc/gld_postfix,GLD (Greylisting Daemon) Postfix Buffer Overflow
exploit/linux/misc/hikvision_rtsp_bof,Hikvision DVR RTSP Request Remote Code Execution
exploit/linux/misc/hp_data_protector_cmd_exec,HP Data Protector 6 EXEC_CMD Remote Code Execution
exploit/linux/misc/hp_nnmi_pmd_bof,HP Network Node Manager I PMD Buffer Overflow
exploit/linux/misc/hp_vsa_login_bof,HP StorageWorks P4000 Virtual SAN Appliance Login Buffer Overflow
exploit/linux/misc/hplip_hpssd_exec,HPLIP hpssd.py From Address Arbitrary Command Execution
exploit/linux/misc/ib_inet_connect,Borland InterBase INET_connect() Buffer Overflow
exploit/linux/misc/ib_jrd8_create_database,Borland InterBase jrd8_create_database() Buffer Overflow
exploit/linux/misc/ib_open_marker_file,Borland InterBase open_marker_file() Buffer Overflow
exploit/linux/misc/ib_pwd_db_aliased,Borland InterBase PWD_db_aliased() Buffer Overflow
exploit/linux/misc/lprng_format_string,LPRng use_syslog Remote Format String Vulnerability
exploit/linux/misc/mongod_native_helper,MongoDB nativeHelper.apply Remote Code Execution
exploit/linux/misc/nagios_nrpe_arguments,Nagios Remote Plugin Executor Arbitrary Command Execution
exploit/linux/misc/netsupport_manager_agent,NetSupport Manager Agent Remote Buffer Overflow
exploit/linux/misc/novell_edirectory_ncp_bof,Novell eDirectory 8 Buffer Overflow
exploit/linux/misc/sercomm_exec,SerComm Device Remote Code Execution
exploit/linux/misc/zabbix_server_exec,Zabbix Server Arbitrary Command Execution
exploit/linux/mysql/mysql_yassl_getname,MySQL yaSSL CertDecoder::GetName Buffer Overflow
exploit/linux/mysql/mysql_yassl_hello,MySQL yaSSL SSL Hello Message Buffer Overflow
exploit/linux/pop3/cyrus_pop3d_popsubfolders,Cyrus IMAPD pop3d popsubfolders USER Buffer Overflow
exploit/linux/postgres/postgres_payload,PostgreSQL for Linux Payload Execution
exploit/linux/pptp/poptop_negative_read,Poptop Negative Read Overflow
exploit/linux/proxy/squid_ntlm_authenticate,Squid NTLM Authenticate Overflow
exploit/linux/samba/chain_reply,Samba chain_reply Memory Corruption (Linux x86)
exploit/linux/samba/lsa_transnames_heap,Samba lsa_io_trans_names Heap Overflow
exploit/linux/samba/setinfopolicy_heap,Samba SetInformationPolicy AuditEventsInfo Heap Overflow
exploit/linux/samba/trans2open,Samba trans2open Overflow (Linux x86)
exploit/linux/smtp/exim4_dovecot_exec,Exim and Dovecot Insecure Configuration Command Injection
exploit/linux/ssh/f5_bigip_known_privkey,F5 BIG-IP SSH Private Key Exposure
exploit/linux/ssh/loadbalancerorg_enterprise_known_privkey,Loadbalancer.org Enterprise VA SSH Private Key Exposure
exploit/linux/ssh/quantum_dxi_known_privkey,Quantum DXi V1000 SSH Private Key Exposure
exploit/linux/ssh/quantum_vmpro_backdoor,Quantum vmPRO Backdoor Command
exploit/linux/ssh/symantec_smg_ssh,Symantec Messaging Gateway 9.5 Default SSH Password Vulnerability
exploit/linux/telnet/telnet_encrypt_keyid,Linux BSD-derived Telnet Service Encryption Key ID Buffer Overflow
exploit/linux/upnp/dlink_upnp_msearch_exec,D-Link Unauthenticated UPnP M-SEARCH Multicast Command Injection
exploit/linux/upnp/miniupnpd_soap_bof,MiniUPnPd 1.0 Stack Buffer Overflow Remote Code Execution
exploit/multi/browser/firefox_escape_retval,Firefox 3.5 escape() Return Value Memory Corruption
exploit/multi/browser/firefox_proto_crmfrequest,Firefox 5.0 - 15.0.1 __exposedProps__ XCS Code Execution
exploit/multi/browser/firefox_queryinterface,Firefox location.QueryInterface() Code Execution
exploit/multi/browser/firefox_svg_plugin,Firefox 17.0.1 Flash Privileged Code Injection
exploit/multi/browser/firefox_tostring_console_injection,Firefox toString console.time Privileged Javascript Injection
exploit/multi/browser/firefox_webidl_injection,Firefox WebIDL Privileged Javascript Injection
exploit/multi/browser/firefox_xpi_bootstrapped_addon,Mozilla Firefox Bootstrapped Addon Social Engineering Code Execution
exploit/multi/browser/itms_overflow,Apple OS X iTunes 8.1.1 ITMS Overflow
exploit/multi/browser/java_atomicreferencearray,Java AtomicReferenceArray Type Violation Vulnerability
exploit/multi/browser/java_calendar_deserialize,Sun Java Calendar Deserialization Privilege Escalation
exploit/multi/browser/java_getsoundbank_bof,Sun Java JRE getSoundbank file:// URI Buffer Overflow
exploit/multi/browser/java_jre17_driver_manager,Java Applet Driver Manager Privileged toString() Remote Code Execution
exploit/multi/browser/java_jre17_exec,Java 7 Applet Remote Code Execution
exploit/multi/browser/java_jre17_glassfish_averagerangestatisticimpl,Java Applet AverageRangeStatisticImpl Remote Code Execution
exploit/multi/browser/java_jre17_jaxws,Java Applet JAX-WS Remote Code Execution
exploit/multi/browser/java_jre17_jmxbean,Java Applet JMX Remote Code Execution
exploit/multi/browser/java_jre17_jmxbean_2,Java Applet JMX Remote Code Execution
exploit/multi/browser/java_jre17_method_handle,Java Applet Method Handle Remote Code Execution
exploit/multi/browser/java_jre17_provider_skeleton,Java Applet ProviderSkeleton Insecure Invoke Method
exploit/multi/browser/java_jre17_reflection_types,Java Applet Reflection Type Confusion Remote Code Execution
exploit/multi/browser/java_rhino,Java Applet Rhino Script Engine Remote Code Execution
exploit/multi/browser/java_rmi_connection_impl,Java RMIConnectionImpl Deserialization Privilege Escalation
exploit/multi/browser/java_setdifficm_bof,Sun Java JRE AWT setDiffICM Buffer Overflow
exploit/multi/browser/java_signed_applet,Java Signed Applet Social Engineering Code Execution
exploit/multi/browser/java_storeimagearray,Java storeImageArray() Invalid Array Indexing Vulnerability
exploit/multi/browser/java_trusted_chain,Java Statement.invoke() Trusted Method Chain Privilege Escalation
exploit/multi/browser/java_verifier_field_access,Java Applet Field Bytecode Verifier Cache Remote Code Execution
exploit/multi/browser/mozilla_compareto,Mozilla Suite/Firefox compareTo() Code Execution
exploit/multi/browser/mozilla_navigatorjava,Mozilla Suite/Firefox Navigator Object Code Execution
exploit/multi/browser/opera_configoverwrite,Opera 9 Configuration Overwrite
exploit/multi/browser/opera_historysearch,Opera historysearch XSS
exploit/multi/browser/qtjava_pointer,Apple QTJava toQTPointer() Arbitrary Memory Access
exploit/multi/elasticsearch/script_mvel_rce,ElasticSearch Dynamic Script Arbitrary Java Execution
exploit/multi/fileformat/adobe_u3d_meshcont,Adobe U3D CLODProgressiveMeshDeclaration Array Overrun
exploit/multi/fileformat/js_unpacker_eval_injection,Javascript Injection for Eval-based Unpackers
exploit/multi/fileformat/maple_maplet,Maple Maplet File Creation and Command Execution
exploit/multi/fileformat/nodejs_js_yaml_load_code_exec,Nodejs js-yaml load() Code Execution
exploit/multi/fileformat/peazip_command_injection,PeaZip Zip Processing Command Injection
exploit/multi/ftp/pureftpd_bash_env_exec,Pure-FTPd External Authentication Bash Environment Variable Code Injection
exploit/multi/ftp/wuftpd_site_exec_format,WU-FTPD SITE EXEC/INDEX Format String Vulnerability
exploit/multi/gdb/gdb_server_exec,GDB Server Remote Payload Execution
exploit/multi/handler,Payload Handler
exploit/multi/http/activecollab_chat,Active Collab "chat module" Remote PHP Code Injection Exploit
exploit/multi/http/ajaxplorer_checkinstall_exec,AjaXplorer checkInstall.php Remote Command Execution
exploit/multi/http/apache_mod_cgi_bash_env_exec,Apache mod_cgi Bash Environment Variable Code Injection
exploit/multi/http/apache_roller_ognl_injection,Apache Roller OGNL Injection
exploit/multi/http/apprain_upload_exec,appRain CMF Arbitrary PHP File Upload Vulnerability
exploit/multi/http/auxilium_upload_exec,Auxilium RateMyPet Arbitrary File Upload Vulnerability
exploit/multi/http/axis2_deployer,Axis2 / SAP BusinessObjects Authenticated Code Execution (via SOAP)
exploit/multi/http/cisco_dcnm_upload,Cisco Prime Data Center Network Manager Arbitrary File Upload
exploit/multi/http/coldfusion_rds,Adobe ColdFusion 9 Administrative Login Bypass
exploit/multi/http/cups_bash_env_exec,CUPS Filter Bash Environment Variable Code Injection
exploit/multi/http/cuteflow_upload_exec,CuteFlow v2.11.2 Arbitrary File Upload Vulnerability
exploit/multi/http/dexter_casinoloader_exec,Dexter (CasinoLoader) SQL Injection
exploit/multi/http/drupal_drupageddon,Drupal HTTP Parameter Key/Value SQL Injection
exploit/multi/http/eaton_nsm_code_exec,Network Shutdown Module (sort_values) Remote PHP Code Injection
exploit/multi/http/eventlog_file_upload,ManageEngine Eventlog Analyzer Arbitrary File Upload
exploit/multi/http/extplorer_upload_exec,eXtplorer v2.1 Arbitrary File Upload Vulnerability
exploit/multi/http/familycms_less_exec,Family Connections less.php Remote Command Execution
exploit/multi/http/freenas_exec_raw,FreeNAS exec_raw.php Arbitrary Command Execution
exploit/multi/http/gestioip_exec,GestioIP Remote Command Execution
exploit/multi/http/git_client_command_exec,Malicious Git and Mercurial HTTP Server For CVE-2014-9390
exploit/multi/http/gitlab_shell_exec,Gitlab-shell Code Execution
exploit/multi/http/gitorious_graph,Gitorious Arbitrary Command Execution
exploit/multi/http/glassfish_deployer,Sun/Oracle GlassFish Server Authenticated Code Execution
exploit/multi/http/glossword_upload_exec,Glossword v1.8.8 - 1.8.12 Arbitrary File Upload Vulnerability
exploit/multi/http/glpi_install_rce,GLPI install.php Remote Command Execution
exploit/multi/http/horde_href_backdoor,Horde 3.3.12 Backdoor Arbitrary PHP Code Execution
exploit/multi/http/hp_sitescope_issuesiebelcmd,HP SiteScope issueSiebelCmd Remote Code Execution
exploit/multi/http/hp_sitescope_uploadfileshandler,HP SiteScope Remote Code Execution
exploit/multi/http/hp_sys_mgmt_exec,HP System Management Homepage JustGetSNMPQueue Command Injection
exploit/multi/http/hyperic_hq_script_console,VMware Hyperic HQ Groovy Script-Console Java Execution
exploit/multi/http/ispconfig_php_exec,ISPConfig Authenticated Arbitrary PHP Code Execution
exploit/multi/http/jboss_bshdeployer,JBoss JMX Console Beanshell Deployer WAR Upload and Deployment
exploit/multi/http/jboss_deploymentfilerepository,JBoss Java Class DeploymentFileRepository WAR Deployment
exploit/multi/http/jboss_invoke_deploy,JBoss DeploymentFileRepository WAR Deployment (via JMXInvokerServlet)
exploit/multi/http/jboss_maindeployer,JBoss JMX Console Deployer Upload and Execute
exploit/multi/http/jenkins_script_console,Jenkins Script-Console Java Execution
exploit/multi/http/kordil_edms_upload_exec,Kordil EDMS v2.2.60rc3 Unauthenticated Arbitrary File Upload Vulnerability
exploit/multi/http/lcms_php_exec,LotusCMS 3.0 eval() Remote Command Execution
exploit/multi/http/log1cms_ajax_create_folder,Log1 CMS writeInfo() PHP Code Injection
exploit/multi/http/manage_engine_dc_pmp_sqli,ManageEngine Desktop Central / Password Manager LinkViewFetchServlet.dat SQL Injection
exploit/multi/http/manageengine_auth_upload,ManageEngine Multiple Products Authenticated File Upload
exploit/multi/http/manageengine_search_sqli,ManageEngine Security Manager Plus 5.5 Build 5505 SQL Injection
exploit/multi/http/mantisbt_php_exec,MantisBT XmlImportExport Plugin PHP Code Injection Vulnerability
exploit/multi/http/mediawiki_thumb,MediaWiki Thumb.php Remote Command Execution
exploit/multi/http/mobilecartly_upload_exec,MobileCartly 1.0 Arbitrary File Creation Vulnerability
exploit/multi/http/moodle_cmd_exec,Moodle Remote Command Execution
exploit/multi/http/movabletype_upgrade_exec,Movable Type 4.2x, 4.3x Web Upgrade Remote Code Execution
exploit/multi/http/mutiny_subnetmask_exec,Mutiny Remote Command Execution
exploit/multi/http/nas4free_php_exec,NAS4Free Arbitrary Remote Code Execution
exploit/multi/http/netwin_surgeftp_exec,Netwin SurgeFTP Remote Command Execution
exploit/multi/http/op5_license,OP5 license.php Remote Command Execution
exploit/multi/http/op5_welcome,OP5 welcome Remote Command Execution
exploit/multi/http/openfire_auth_bypass,Openfire Admin Console Authentication Bypass
exploit/multi/http/openmediavault_cmd_exec,OpenMediaVault Cron Remote Command Execution
exploit/multi/http/openx_backdoor_php,OpenX Backdoor PHP Code Execution
exploit/multi/http/opmanager_socialit_file_upload,ManageEngine OpManager and Social IT Arbitrary File Upload
exploit/multi/http/oracle_reports_rce,Oracle Forms and Reports Remote Code Execution
exploit/multi/http/pandora_upload_exec,Pandora FMS v3.1 Auth Bypass and Arbitrary File Upload Vulnerability
exploit/multi/http/php_cgi_arg_injection,PHP CGI Argument Injection
exploit/multi/http/php_volunteer_upload_exec,PHP Volunteer Management System v1.0.2 Arbitrary File Upload Vulnerability
exploit/multi/http/phpldapadmin_query_engine,phpLDAPadmin query_engine Remote PHP Code Injection
exploit/multi/http/phpmoadmin_exec,PHPMoAdmin 1.1.2 Remote Code Execution
exploit/multi/http/phpmyadmin_3522_backdoor,phpMyAdmin 3.5.2.2 server_sync.php Backdoor
exploit/multi/http/phpmyadmin_preg_replace,phpMyAdmin Authenticated Remote Code Execution via preg_replace()
exploit/multi/http/phpscheduleit_start_date,phpScheduleIt PHP reserve.php start_date Parameter Arbitrary Code Injection
exploit/multi/http/phptax_exec,PhpTax pfilez Parameter Exec Remote Code Injection
exploit/multi/http/phpwiki_ploticus_exec,Phpwiki Ploticus Remote Code Execution
exploit/multi/http/plone_popen2,Plone and Zope XMLTools Remote Command Execution
exploit/multi/http/pmwiki_pagelist,PmWiki pagelist.php Remote PHP Code Injection Exploit
exploit/multi/http/polarcms_upload_exec,PolarBear CMS PHP File Upload Vulnerability
exploit/multi/http/processmaker_exec,ProcessMaker Open Source Authenticated PHP Code Execution
exploit/multi/http/qdpm_upload_exec,qdPM v7 Arbitrary PHP File Upload Vulnerability
exploit/multi/http/rails_json_yaml_code_exec,Ruby on Rails JSON Processor YAML Deserialization Code Execution
exploit/multi/http/rails_secret_deserialization,Ruby on Rails Known Secret Session Cookie Remote Code Execution
exploit/multi/http/rails_xml_yaml_code_exec,Ruby on Rails XML Processor YAML Deserialization Code Execution
exploit/multi/http/rocket_servergraph_file_requestor_rce,Rocket Servergraph Admin Center fileRequestor Remote Code Execution
exploit/multi/http/sflog_upload_exec,Sflog! CMS 1.0 Arbitrary File Upload Vulnerability
exploit/multi/http/sit_file_upload,Support Incident Tracker Remote Command Execution
exploit/multi/http/snortreport_exec,Snortreport nmap.php/nbtscan.php Remote Command Execution
exploit/multi/http/solarwinds_store_manager_auth_filter,SolarWinds Storage Manager Authentication Bypass
exploit/multi/http/sonicwall_gms_upload,SonicWALL GMS 6 Arbitrary File Upload
exploit/multi/http/splunk_mappy_exec,Splunk Search Remote Code Execution
exploit/multi/http/splunk_upload_app_exec,Splunk Custom App Remote Code Execution
exploit/multi/http/spree_search_exec,Spreecommerce 0.60.1 Arbitrary Command Execution
exploit/multi/http/spree_searchlogic_exec,Spreecommerce Arbitrary Command Execution
exploit/multi/http/struts_code_exec,Apache Struts Remote Command Execution
exploit/multi/http/struts_code_exec_classloader,Apache Struts ClassLoader Manipulation Remote Code Execution
exploit/multi/http/struts_code_exec_exception_delegator,Apache Struts Remote Command Execution
exploit/multi/http/struts_code_exec_parameters,Apache Struts ParametersInterceptor Remote Code Execution
exploit/multi/http/struts_default_action_mapper,Apache Struts 2 DefaultActionMapper Prefixes OGNL Code Execution
exploit/multi/http/struts_dev_mode,Apache Struts 2 Developer Mode OGNL Execution
exploit/multi/http/struts_include_params,Apache Struts includeParams Remote Code Execution
exploit/multi/http/stunshell_eval,STUNSHELL Web Shell Remote PHP Code Execution
exploit/multi/http/stunshell_exec,STUNSHELL Web Shell Remote Code Execution
exploit/multi/http/sun_jsws_dav_options,Sun Java System Web Server WebDAV OPTIONS Buffer Overflow
exploit/multi/http/testlink_upload_exec,TestLink v1.9.3 Arbitrary File Upload Vulnerability
exploit/multi/http/tomcat_mgr_deploy,Apache Tomcat Manager Application Deployer Authenticated Code Execution
