exploit/aix/local/ibstat_path,ibstat $PATH Privilege Escalation
exploit/windows/http/mdaemon_worldclient_form2raw,MDaemon WorldClient form2raw.cgi Stack Buffer Overflow
exploit/windows/http/minishare_get_overflow,Minishare 1.4.1 Buffer Overflow
exploit/windows/http/miniweb_upload_wbem,MiniWeb (Build 300) Arbitrary File Upload
exploit/windows/http/navicopa_get_overflow,NaviCOPA 2.0.1 URL Handling Buffer Overflow
exploit/windows/http/netdecision_http_bof,NetDecision 4.5.1 HTTP Server Buffer Overflow
exploit/windows/http/novell_imanager_upload,Novell iManager getMultiPartParameters Arbitrary File Upload
exploit/windows/http/novell_mdm_lfi,Novell Zenworks Mobile Managment MDM.php Local File Inclusion Vulnerability
exploit/windows/http/novell_messenger_acceptlang,Novell Messenger Server 2.0 Accept-Language Overflow
exploit/windows/http/nowsms,Now SMS/MMS Gateway Buffer Overflow
exploit/windows/http/oracle9i_xdb_pass,Oracle 9i XDB HTTP PASS Overflow (win32)
exploit/windows/http/oracle_btm_writetofile,Oracle Business Transaction Management FlashTunnelService Remote Code Execution
exploit/windows/http/oracle_endeca_exec,Oracle Endeca Server Remote Command Execution
exploit/windows/http/oracle_event_processing_upload,Oracle Event Processing FileUploadServlet Arbitrary File Upload
exploit/windows/http/osb_uname_jlist,Oracle Secure Backup Authentication Bypass/Command Injection Vulnerability
exploit/windows/http/peercast_url,PeerCast URL Handling Buffer Overflow
exploit/windows/http/php_apache_request_headers_bof,PHP apache_request_headers Function Buffer Overflow
exploit/windows/http/privatewire_gateway,Private Wire Gateway Buffer Overflow
exploit/windows/http/psoproxy91_overflow,PSO Proxy v0.91 Stack Buffer Overflow
exploit/windows/http/rabidhamster_r4_log,RabidHamster R4 Log Entry sprintf() Buffer Overflow
exploit/windows/http/rejetto_hfs_exec,Rejetto HttpFileServer Remote Command Execution
exploit/windows/http/sambar6_search_results,Sambar 6 Search Results Buffer Overflow
exploit/windows/http/sap_configservlet_exec_noauth,SAP ConfigServlet Remote Code Execution
exploit/windows/http/sap_host_control_cmd_exec,SAP NetWeaver HostControl Command Injection
exploit/windows/http/sapdb_webtools,SAP DB 7.4 WebTools Buffer Overflow
exploit/windows/http/savant_31_overflow,Savant 3.1 Web Server Overflow
exploit/windows/http/servu_session_cookie,Rhinosoft Serv-U Session Cookie Buffer Overflow
exploit/windows/http/shoutcast_format,SHOUTcast DNAS/win32 1.9.4 File Request Format String Overflow
exploit/windows/http/shttpd_post,SHTTPD URI-Encoded POST Request Overflow
exploit/windows/http/solarwinds_storage_manager_sql,Solarwinds Storage Manager 5.1.0 SQL Injection
exploit/windows/http/sonicwall_scrutinizer_sqli,Dell SonicWALL (Plixer) Scrutinizer 9 SQL Injection
exploit/windows/http/steamcast_useragent,Streamcast HTTP User-Agent Buffer Overflow
exploit/windows/http/sws_connection_bof,Simple Web Server Connection Header Buffer Overflow
exploit/windows/http/sybase_easerver,Sybase EAServer 5.2 Remote Stack Buffer Overflow
exploit/windows/http/sysax_create_folder,Sysax Multi Server 5.64 Create Folder Buffer Overflow
exploit/windows/http/trackercam_phparg_overflow,TrackerCam PHP Argument Buffer Overflow
exploit/windows/http/trackit_file_upload,Numara / BMC Track-It! FileStorageService Arbitrary File Upload
exploit/windows/http/trendmicro_officescan,Trend Micro OfficeScan Remote Stack Buffer Overflow
exploit/windows/http/ultraminihttp_bof,Ultra Mini HTTPD Stack Buffer Overflow
exploit/windows/http/umbraco_upload_aspx,Umbraco CMS Remote Command Execution
exploit/windows/http/vmware_vcenter_chargeback_upload,VMware vCenter Chargeback Manager ImageUploadServlet Arbitrary File Upload
exploit/windows/http/webster_http,Webster HTTP Server GET Buffer Overflow
exploit/windows/http/xampp_webdav_upload_php,XAMPP WebDAV PHP Upload
exploit/windows/http/xitami_if_mod_since,Xitami 2.5c2 Web Server If-Modified-Since Overflow
exploit/windows/http/zenworks_assetmgmt_uploadservlet,Novell ZENworks Asset Management Remote Execution
exploit/windows/http/zenworks_uploadservlet,Novell ZENworks Configuration Management Remote Execution
exploit/windows/iis/iis_webdav_upload_asp,Microsoft IIS WebDAV Write Access Code Execution
exploit/windows/iis/ms01_023_printer,MS01-023 Microsoft IIS 5.0 Printer Host Header Overflow
exploit/windows/iis/ms01_026_dbldecode,MS01-026 Microsoft IIS/PWS CGI Filename Double Decode Command Execution
exploit/windows/iis/ms01_033_idq,MS01-033 Microsoft IIS 5.0 IDQ Path Overflow
exploit/windows/iis/ms02_018_htr,MS02-018 Microsoft IIS 4.0 .HTR Path Overflow
exploit/windows/iis/ms02_065_msadc,MS02-065 Microsoft IIS MDAC msadcs.dll RDS DataStub Content-Type Overflow
exploit/windows/iis/ms03_007_ntdll_webdav,MS03-007 Microsoft IIS 5.0 WebDAV ntdll.dll Path Overflow
exploit/windows/iis/msadc,MS99-025 Microsoft IIS MDAC msadcs.dll RDS Arbitrary Remote Command Execution
exploit/windows/imap/eudora_list,Qualcomm WorldMail 3.0 IMAPD LIST Buffer Overflow
exploit/windows/imap/imail_delete,IMail IMAP4D Delete Overflow
exploit/windows/imap/ipswitch_search,Ipswitch IMail IMAP SEARCH Buffer Overflow
exploit/windows/imap/mailenable_login,MailEnable IMAPD (2.34/2.35) Login Request Buffer Overflow
exploit/windows/imap/mailenable_status,MailEnable IMAPD (1.54) STATUS Request Buffer Overflow
exploit/windows/imap/mailenable_w3c_select,MailEnable IMAPD W3C Logging Buffer Overflow
exploit/windows/imap/mdaemon_cram_md5,Mdaemon 8.0.3 IMAPD CRAM-MD5 Authentication Overflow
exploit/windows/imap/mdaemon_fetch,MDaemon 9.6.4 IMAPD FETCH Buffer Overflow
exploit/windows/imap/mercur_imap_select_overflow,Mercur v5.0 IMAP SP3 SELECT Buffer Overflow
exploit/windows/imap/mercur_login,Mercur Messaging 2005 IMAP Login Buffer Overflow
exploit/windows/imap/mercury_login,Mercury/32 LOGIN Buffer Overflow
exploit/windows/imap/mercury_rename,Mercury/32 v4.01a IMAP RENAME Buffer Overflow
exploit/windows/imap/novell_netmail_append,Novell NetMail IMAP APPEND Buffer Overflow
exploit/windows/imap/novell_netmail_auth,Novell NetMail IMAP AUTHENTICATE Buffer Overflow
exploit/windows/imap/novell_netmail_status,Novell NetMail IMAP STATUS Buffer Overflow
exploit/windows/imap/novell_netmail_subscribe,Novell NetMail IMAP SUBSCRIBE Buffer Overflow
exploit/windows/isapi/ms00_094_pbserver,MS00-094 Microsoft IIS Phone Book Service Overflow
exploit/windows/isapi/ms03_022_nsiislog_post,MS03-022 Microsoft IIS ISAPI nsiislog.dll ISAPI POST Overflow
exploit/windows/isapi/ms03_051_fp30reg_chunked,MS03-051 Microsoft IIS ISAPI FrontPage fp30reg.dll Chunked Overflow
exploit/windows/isapi/rsa_webagent_redirect,Microsoft IIS ISAPI RSA WebAgent Redirect Overflow
exploit/windows/isapi/w3who_query,Microsoft IIS ISAPI w3who.dll Query String Overflow
exploit/windows/ldap/imail_thc,IMail LDAP Service Buffer Overflow
exploit/windows/ldap/pgp_keyserver7,Network Associates PGP KeyServer 7 LDAP Buffer Overflow
exploit/windows/license/calicclnt_getconfig,Computer Associates License Client GETCONFIG Overflow
exploit/windows/license/calicserv_getconfig,Computer Associates License Server GETCONFIG Overflow
exploit/windows/license/flexnet_lmgrd_bof,FlexNet License Server Manager lmgrd Buffer Overflow
exploit/windows/license/sentinel_lm7_udp,SentinelLM UDP Buffer Overflow
exploit/windows/local/adobe_sandbox_adobecollabsync,AdobeCollabSync Buffer Overflow Adobe Reader X Sandbox Bypass
exploit/windows/local/agnitum_outpost_acs,Agnitum Outpost Internet Security Local Privilege Escalation
exploit/windows/local/always_install_elevated,Windows AlwaysInstallElevated MSI
exploit/windows/local/ask,Windows Escalate UAC Execute RunAs
exploit/windows/local/bthpan,Microsoft Bluetooth Personal Area Networking (BthPan.sys) Privilege Escalation
exploit/windows/local/bypassuac,Windows Escalate UAC Protection Bypass
exploit/windows/local/bypassuac_injection,Windows Escalate UAC Protection Bypass (In Memory Injection)
exploit/windows/local/current_user_psexec,PsExec via Current User Token
exploit/windows/local/ikeext_service,IKE and AuthIP IPsec Keyring Modules Service (IKEEXT) Missing DLL
exploit/windows/local/mqac_write,MQAC.sys Arbitrary Write Privilege Escalation
exploit/windows/local/ms10_015_kitrap0d,Windows SYSTEM Escalation via KiTrap0D
exploit/windows/local/ms10_092_schelevator,Windows Escalate Task Scheduler XML Privilege Escalation
exploit/windows/local/ms11_080_afdjoinleaf,MS11-080 AfdJoinLeaf Privilege Escalation
exploit/windows/local/ms13_005_hwnd_broadcast,MS13-005 HWND_BROADCAST Low to Medium Integrity Privilege Escalation
exploit/windows/local/ms13_053_schlamperei,Windows NTUserMessageCall Win32k Kernel Pool Overflow (Schlamperei)
exploit/windows/local/ms13_081_track_popup_menu,Windows TrackPopupMenuEx Win32k NULL Page
exploit/windows/local/ms13_097_ie_registry_symlink,MS13-097 Registry Symlink IE Sandbox Escape
exploit/windows/local/ms14_009_ie_dfsvc,MS14-009 .NET Deployment Service IE Sandbox Escape
exploit/windows/local/ms14_058_track_popup_menu,Windows TrackPopupMenu Win32k NULL Pointer Dereference
exploit/windows/local/ms14_070_tcpip_ioctl,MS14-070 Windows tcpip!SetAddrOptions NULL Pointer Dereference
exploit/windows/local/ms15_004_tswbproxy,MS15-004 Microsoft Remote Desktop Services Web Proxy IE Sandbox Escape
exploit/windows/local/ms_ndproxy,MS14-002 Microsoft Windows ndproxy.sys Local Privilege Escalation
exploit/windows/local/novell_client_nicm,Novell Client 2 SP3 nicm.sys Local Privilege Escalation
exploit/windows/local/novell_client_nwfs,Novell Client 4.91 SP4 nwfs.sys Local Privilege Escalation
exploit/windows/local/ntapphelpcachecontrol,MS15-001 Microsoft Windows NtApphelpCacheControl Improper Authorization Check
exploit/windows/local/nvidia_nvsvc,Nvidia (nvsvc) Display Driver Service Local Privilege Escalation
exploit/windows/local/payload_inject,Windows Manage Memory Payload Injection
exploit/windows/local/persistence,Windows Manage Persistent Payload Installer
exploit/windows/local/powershell_cmd_upgrade,Windows Command Shell Upgrade (Powershell)
exploit/windows/local/ppr_flatten_rec,Windows EPATHOBJ::pprFlattenRec Local Privilege Escalation
exploit/windows/local/pxeexploit,PXE Exploit Server
exploit/windows/local/s4u_persistence,Windows Manage User Level Persistent Payload Installer
exploit/windows/local/service_permissions,Windows Escalate Service Permissions Local Privilege Escalation
exploit/windows/local/trusted_service_path,Windows Service Trusted Path Privilege Escalation
exploit/windows/local/virtual_box_guest_additions,VirtualBox Guest Additions VBoxGuest.sys Privilege Escalation
exploit/windows/local/virtual_box_opengl_escape,VirtualBox 3D Acceleration Virtual Machine Escape
exploit/windows/local/vss_persistence,Persistent Payload in Windows Volume Shadow Copy
exploit/windows/local/wmi,Windows Management Instrumentation (WMI) Remote Command Execution
exploit/windows/lotus/domino_http_accept_language,IBM Lotus Domino Web Server Accept-Language Stack Buffer Overflow
exploit/windows/lotus/domino_icalendar_organizer,IBM Lotus Domino iCalendar MAILTO Buffer Overflow
exploit/windows/lotus/domino_sametime_stmux,IBM Lotus Domino Sametime STMux.exe Stack Buffer Overflow
exploit/windows/lotus/lotusnotes_lzh,Lotus Notes 8.0.x - 8.5.2 FP2 - Autonomy Keyview (.lzh Attachment)
exploit/windows/lpd/hummingbird_exceed,Hummingbird Connectivity 10 SP5 LPD Buffer Overflow
exploit/windows/lpd/niprint,NIPrint LPD Request Overflow
exploit/windows/lpd/saplpd,SAP SAPLPD 6.28 Buffer Overflow
exploit/windows/lpd/wincomlpd_admin,WinComLPD Buffer Overflow
exploit/windows/misc/achat_bof,Achat Unicode SEH Buffer Overflow
exploit/windows/misc/actfax_raw_server_bof,ActFax 5.01 RAW Server Buffer Overflow
exploit/windows/misc/agentxpp_receive_agentx,AgentX++ Master AgentX::receive_agentx Stack Buffer Overflow
exploit/windows/misc/allmediaserver_bof,ALLMediaServer 0.8 Buffer Overflow
exploit/windows/misc/altiris_ds_sqli,Symantec Altiris DS SQL Injection
exploit/windows/misc/apple_quicktime_rtsp_response,Apple QuickTime 7.3 RTSP Response Header Buffer Overflow
exploit/windows/misc/asus_dpcproxy_overflow,Asus Dpcproxy Buffer Overflow
exploit/windows/misc/avaya_winpmd_unihostrouter,Avaya WinPMD UniteHostRouter Buffer Overflow
exploit/windows/misc/avidphoneticindexer,Avid Media Composer 5.5 - Avid Phonetic Indexer Buffer Overflow
exploit/windows/misc/bakbone_netvault_heap,BakBone NetVault Remote Heap Overflow
exploit/windows/misc/bcaaa_bof,Blue Coat Authentication and Authorization Agent (BCAAA) 5 Buffer Overflow
exploit/windows/misc/bigant_server,BigAnt Server 2.2 Buffer Overflow
exploit/windows/misc/bigant_server_250,BigAnt Server 2.50 SP1 Buffer Overflow
exploit/windows/misc/bigant_server_dupf_upload,BigAnt Server DUPF Command Arbitrary File Upload
exploit/windows/misc/bigant_server_sch_dupf_bof,BigAnt Server 2 SCH And DUPF Buffer Overflow
exploit/windows/misc/bigant_server_usv,BigAnt Server 2.52 USV Buffer Overflow
exploit/windows/misc/bomberclone_overflow,Bomberclone 0.11.6 Buffer Overflow
exploit/windows/misc/bopup_comm,Bopup Communications Server Buffer Overflow
exploit/windows/misc/borland_interbase,Borland Interbase Create-Request Buffer Overflow
exploit/windows/misc/borland_starteam,Borland CaliberRM StarTeam Multicast Service Buffer Overflow
exploit/windows/misc/citrix_streamprocess,Citrix Provisioning Services 5.6 streamprocess.exe Buffer Overflow
exploit/windows/misc/citrix_streamprocess_data_msg,Citrix Provisioning Services 5.6 SP1 Streamprocess Opcode 0x40020000 Buffer Overflow
exploit/windows/misc/citrix_streamprocess_get_boot_record_request,Citrix Provisioning Services 5.6 SP1 Streamprocess Opcode 0x40020004 Buffer Overflow
exploit/windows/misc/citrix_streamprocess_get_footer,Citrix Provisioning Services 5.6 SP1 Streamprocess Opcode 0x40020002 Buffer Overflow
exploit/windows/misc/citrix_streamprocess_get_objects,Citrix Provisioning Services 5.6 SP1 Streamprocess Opcode 0x40020006 Buffer Overflow
exploit/windows/misc/doubletake,DoubleTake/HP StorageWorks Storage Mirroring Service Authentication Overflow
exploit/windows/misc/eiqnetworks_esa,eIQNetworks ESA License Manager LICMGR_ADDLICENSE Overflow
exploit/windows/misc/eiqnetworks_esa_topology,eIQNetworks ESA Topology DELETEDEVICE Overflow
exploit/windows/misc/enterasys_netsight_syslog_bof,Enterasys NetSight nssyslogd.exe Buffer Overflow
exploit/windows/misc/eureka_mail_err,Eureka Email 2.2q ERR Remote Buffer Overflow
exploit/windows/misc/fb_cnct_group,Firebird Relational Database CNCT Group Number Buffer Overflow
exploit/windows/misc/fb_isc_attach_database,Firebird Relational Database isc_attach_database() Buffer Overflow
exploit/windows/misc/fb_isc_create_database,Firebird Relational Database isc_create_database() Buffer Overflow
exploit/windows/misc/fb_svc_attach,Firebird Relational Database SVC_attach() Buffer Overflow
exploit/windows/misc/gimp_script_fu,GIMP script-fu Server Buffer Overflow
exploit/windows/misc/hp_dataprotector_cmd_exec,HP Data Protector 8.10 Remote Command Execution
exploit/windows/misc/hp_dataprotector_crs,HP Data Protector Cell Request Service Buffer Overflow
exploit/windows/misc/hp_dataprotector_dtbclslogin,HP Data Protector DtbClsLogin Buffer Overflow
exploit/windows/misc/hp_dataprotector_exec_bar,HP Data Protector Backup Client Service Remote Code Execution
exploit/windows/misc/hp_dataprotector_new_folder,HP Data Protector Create New Folder Buffer Overflow
exploit/windows/misc/hp_dataprotector_traversal,HP Data Protector Backup Client Service Directory Traversal
exploit/windows/misc/hp_imc_uam,HP Intelligent Management Center UAM Buffer Overflow
exploit/windows/misc/hp_loadrunner_magentproc,HP LoadRunner magentproc.exe Overflow
exploit/windows/misc/hp_magentservice,HP Diagnostics Server magentservice.exe Overflow
exploit/windows/misc/hp_omniinet_1,HP OmniInet.exe MSG_PROTOCOL Buffer Overflow
exploit/windows/misc/hp_omniinet_2,HP OmniInet.exe MSG_PROTOCOL Buffer Overflow
exploit/windows/misc/hp_omniinet_3,HP OmniInet.exe Opcode 27 Buffer Overflow
exploit/windows/misc/hp_omniinet_4,HP OmniInet.exe Opcode 20 Buffer Overflow
exploit/windows/misc/hp_operations_agent_coda_34,HP Operations Agent Opcode coda.exe 0x34 Buffer Overflow
exploit/windows/misc/hp_operations_agent_coda_8c,HP Operations Agent Opcode coda.exe 0x8c Buffer Overflow
exploit/windows/misc/hp_ovtrace,HP OpenView Operations OVTrace Buffer Overflow
exploit/windows/misc/ib_isc_attach_database,Borland InterBase isc_attach_database() Buffer Overflow
exploit/windows/misc/ib_isc_create_database,Borland InterBase isc_create_database() Buffer Overflow
exploit/windows/misc/ib_svc_attach,Borland InterBase SVC_attach() Buffer Overflow
exploit/windows/misc/ibm_cognos_tm1admsd_bof,IBM Cognos tm1admsd.exe Overflow
exploit/windows/misc/ibm_director_cim_dllinject,IBM System Director Agent DLL Injection
exploit/windows/misc/ibm_tsm_cad_ping,IBM Tivoli Storage Manager Express CAD Service Buffer Overflow
exploit/windows/misc/ibm_tsm_rca_dicugetidentify,IBM Tivoli Storage Manager Express RCA Service Buffer Overflow
exploit/windows/misc/itunes_extm3u_bof,Apple iTunes 10 Extended M3U Stack Buffer Overflow
exploit/windows/misc/landesk_aolnsrvr,LANDesk Management Suite 8.7 Alert Service Buffer Overflow
exploit/windows/misc/lianja_db_net,Lianja SQL 1.0.0RC5.1 db_netserver Stack Buffer Overflow
exploit/windows/misc/mercury_phonebook,Mercury/32 PH Server Module Buffer Overflow
exploit/windows/misc/mini_stream,Mini-Stream 3.0.1.1 Buffer Overflow
exploit/windows/misc/mirc_privmsg_server,mIRC PRIVMSG Handling Stack Buffer Overflow
exploit/windows/misc/ms07_064_sami,MS07-064 Microsoft DirectX DirectShow SAMI Buffer Overflow
exploit/windows/misc/ms10_104_sharepoint,MS10-104 Microsoft Office SharePoint Server 2007 Remote Code Execution
exploit/windows/misc/netcat110_nt,Netcat v1.10 NT Stack Buffer Overflow
exploit/windows/misc/nettransport,NetTransport Download Manager 2.90.510 Buffer Overflow
exploit/windows/misc/nvidia_mental_ray,Nvidia Mental Ray Satellite Service Arbitrary DLL Injection
exploit/windows/misc/poisonivy_bof,Poison Ivy Server Buffer Overflow
exploit/windows/misc/poppeeper_date,POP Peeper v3.4 DATE Buffer Overflow
exploit/windows/misc/poppeeper_uidl,POP Peeper v3.4 UIDL Buffer Overflow
exploit/windows/misc/realtek_playlist,Realtek Media Player Playlist Buffer Overflow
exploit/windows/misc/sap_2005_license,SAP Business One License Manager 2005 Buffer Overflow
exploit/windows/misc/sap_netweaver_dispatcher,SAP NetWeaver Dispatcher DiagTraceR3Info Buffer Overflow
exploit/windows/misc/shixxnote_font,ShixxNOTE 6.net Font Field Overflow
exploit/windows/misc/solidworks_workgroup_pdmwservice_file_write,SolidWorks Workgroup PDM 2014 pdmwService.exe Arbitrary File Write
exploit/windows/misc/splayer_content_type,SPlayer 3.7 Content-Type Buffer Overflow
exploit/windows/misc/stream_down_bof,CoCSoft StreamDown 6.8.0 Buffer Overflow
exploit/windows/misc/talkative_response,Talkative IRC v0.4.4.16 Response Buffer Overflow
exploit/windows/misc/tiny_identd_overflow,TinyIdentD 2.2 Stack Buffer Overflow
exploit/windows/misc/trendmicro_cmdprocessor_addtask,TrendMicro Control Manger CmdProcessor.exe Stack Buffer Overflow
exploit/windows/misc/ufo_ai,UFO: Alien Invasion IRC Client Buffer Overflow
exploit/windows/misc/windows_rsh,Windows RSH Daemon Buffer Overflow
exploit/windows/misc/wireshark_lua,Wireshark console.lua Pre-Loading Script Execution
exploit/windows/misc/wireshark_packet_dect,Wireshark packet-dect.c Stack Buffer Overflow
exploit/windows/mmsp/ms10_025_wmss_connect_funnel,Windows Media Services ConnectFunnel Stack Buffer Overflow
exploit/windows/motorola/timbuktu_fileupload,Timbuktu Pro Directory Traversal/File Upload
exploit/windows/mssql/lyris_listmanager_weak_pass,Lyris ListManager MSDE Weak sa Password
exploit/windows/mssql/ms02_039_slammer,MS02-039 Microsoft SQL Server Resolution Overflow
exploit/windows/mssql/ms02_056_hello,MS02-056 Microsoft SQL Server Hello Overflow
exploit/windows/mssql/ms09_004_sp_replwritetovarbin,MS09-004 Microsoft SQL Server sp_replwritetovarbin Memory Corruption
exploit/windows/mssql/ms09_004_sp_replwritetovarbin_sqli,MS09-004 Microsoft SQL Server sp_replwritetovarbin Memory Corruption via SQL Injection
exploit/windows/mssql/mssql_linkcrawler,Microsoft SQL Server Database Link Crawling Command Execution
exploit/windows/mssql/mssql_payload,Microsoft SQL Server Payload Execution
exploit/windows/mssql/mssql_payload_sqli,Microsoft SQL Server Payload Execution via SQL Injection
exploit/windows/mysql/mysql_mof,Oracle MySQL for Microsoft Windows MOF Execution
exploit/windows/mysql/mysql_payload,Oracle MySQL for Microsoft Windows Payload Execution
exploit/windows/mysql/mysql_start_up,Oracle MySQL for Microsoft Windows FILE Privilege Abuse
exploit/windows/mysql/mysql_yassl_hello,MySQL yaSSL SSL Hello Message Buffer Overflow
exploit/windows/mysql/scrutinizer_upload_exec,Plixer Scrutinizer NetFlow and sFlow Analyzer 9 Default MySQL Credential
exploit/windows/nfs/xlink_nfsd,Omni-NFS Server Buffer Overflow
exploit/windows/nntp/ms05_030_nntp,MS05-030 Microsoft Outlook Express NNTP Response Parsing Buffer Overflow
exploit/windows/novell/file_reporter_fsfui_upload,NFR Agent FSFUI Record File Upload RCE
exploit/windows/novell/groupwisemessenger_client,Novell GroupWise Messenger Client Buffer Overflow
exploit/windows/novell/netiq_pum_eval,NetIQ Privileged User Manager 2.3.1 ldapagnt_eval() Remote Perl Code Execution
exploit/windows/novell/nmap_stor,Novell NetMail NMAP STOR Buffer Overflow
exploit/windows/novell/zenworks_desktop_agent,Novell ZENworks 6.5 Desktop/Server Management Overflow
exploit/windows/novell/zenworks_preboot_op21_bof,Novell ZENworks Configuration Management Preboot Service 0x21 Buffer Overflow
exploit/windows/novell/zenworks_preboot_op4c_bof,Novell ZENworks Configuration Management Preboot Service 0x4c Buffer Overflow
exploit/windows/novell/zenworks_preboot_op6_bof,Novell ZENworks Configuration Management Preboot Service 0x06 Buffer Overflow
exploit/windows/novell/zenworks_preboot_op6c_bof,Novell ZENworks Configuration Management Preboot Service 0x6c Buffer Overflow
exploit/windows/oracle/client_system_analyzer_upload,Oracle Database Client System Analyzer Arbitrary File Upload
exploit/windows/oracle/extjob,Oracle Job Scheduler Named Pipe Command Execution
exploit/windows/oracle/osb_ndmp_auth,Oracle Secure Backup NDMP_CONNECT_CLIENT_AUTH Buffer Overflow
exploit/windows/oracle/tns_arguments,Oracle 8i TNS Listener (ARGUMENTS) Buffer Overflow
exploit/windows/oracle/tns_auth_sesskey,Oracle 10gR2 TNS Listener AUTH_SESSKEY Buffer Overflow
exploit/windows/oracle/tns_service_name,Oracle 8i TNS Listener SERVICE_NAME Buffer Overflow
exploit/windows/pop3/seattlelab_pass,Seattle Lab Mail 5.5 POP3 Buffer Overflow
exploit/windows/postgres/postgres_payload,PostgreSQL for Microsoft Windows Payload Execution
exploit/windows/proxy/bluecoat_winproxy_host,Blue Coat WinProxy Host Header Overflow
exploit/windows/proxy/ccproxy_telnet_ping,CCProxy Telnet Proxy Ping Overflow
exploit/windows/proxy/proxypro_http_get,Proxy-Pro Professional GateKeeper 4.7 GET Request Overflow
exploit/windows/proxy/qbik_wingate_wwwproxy,Qbik WinGate WWW Proxy Server URL Processing Overflow
exploit/windows/scada/abb_wserver_exec,ABB MicroSCADA wserver.exe Remote Code Execution
exploit/windows/scada/citect_scada_odbc,CitectSCADA/CitectFacilities ODBC Buffer Overflow
exploit/windows/scada/codesys_gateway_server_traversal,SCADA 3S CoDeSys Gateway Server Directory Traversal
exploit/windows/scada/codesys_web_server,SCADA 3S CoDeSys CmpWebServer Stack Buffer Overflow
exploit/windows/scada/daq_factory_bof,DaqFactory HMI NETB Request Overflow
exploit/windows/scada/factorylink_csservice,Siemens FactoryLink 8 CSService Logging Path Param Buffer Overflow
exploit/windows/scada/factorylink_vrn_09,Siemens FactoryLink vrn.exe Opcode 9 Buffer Overflow
exploit/windows/scada/ge_proficy_cimplicity_gefebt,GE Proficy CIMPLICITY gefebt.exe Remote Code Execution
exploit/windows/scada/iconics_genbroker,Iconics GENESIS32 Integer Overflow Version 9.21.201.01
exploit/windows/scada/iconics_webhmi_setactivexguid,ICONICS WebHMI ActiveX Buffer Overflow
exploit/windows/scada/igss9_igssdataserver_listall,7-Technologies IGSS IGSSdataServer.exe Stack Buffer Overflow
exploit/windows/scada/igss9_igssdataserver_rename,7-Technologies IGSS 9 IGSSdataServer .RMS Rename Buffer Overflow
exploit/windows/scada/igss9_misc,7-Technologies IGSS 9 Data Server/Collector Packet Handling Vulnerabilities
exploit/windows/scada/igss_exec_17,Interactive Graphical SCADA System Remote Command Injection
exploit/windows/scada/indusoft_webstudio_exec,InduSoft Web Studio Arbitrary Upload Remote Code Execution
exploit/windows/scada/moxa_mdmtool,MOXA Device Manager Tool 2.1 Buffer Overflow
exploit/windows/scada/procyon_core_server,Procyon Core Server HMI Coreservice.exe Stack Buffer Overflow
exploit/windows/scada/realwin,DATAC RealWin SCADA Server Buffer Overflow
exploit/windows/scada/realwin_on_fc_binfile_a,DATAC RealWin SCADA Server 2 On_FC_CONNECT_FCS_a_FILE Buffer Overflow
exploit/windows/scada/realwin_on_fcs_login,RealWin SCADA Server DATAC Login Buffer Overflow
exploit/windows/scada/realwin_scpc_initialize,DATAC RealWin SCADA Server SCPC_INITIALIZE Buffer Overflow
exploit/windows/scada/realwin_scpc_initialize_rf,DATAC RealWin SCADA Server SCPC_INITIALIZE_RF Buffer Overflow
exploit/windows/scada/realwin_scpc_txtevent,DATAC RealWin SCADA Server SCPC_TXTEVENT Buffer Overflow
exploit/windows/scada/scadapro_cmdexe,Measuresoft ScadaPro Remote Command Execution
exploit/windows/scada/sunway_force_control_netdbsrv,Sunway Forcecontrol SNMP NetDBServer.exe Opcode 0x57
exploit/windows/scada/winlog_runtime,Sielco Sistemi Winlog Buffer Overflow
exploit/windows/scada/winlog_runtime_2,Sielco Sistemi Winlog Buffer Overflow 2.07.14 - 2.07.16
exploit/windows/scada/yokogawa_bkbcopyd_bof,Yokogawa CENTUM CS 3000 BKBCopyD.exe Buffer Overflow
